Silverstone DA750 Gold,750,157.0,80+ Gold,silverstone triton rz gold,B-,"Claims an ICB fan, actually uses an LLS (rifle) bearing. Noisy ~40dBA for 750W and in excess of 48dBA for the 850W under full load.",108.12142857142857,//cdna.pcpartpicker.com/static/forever/images/product/86e43d07e104412be4e0e875349a9ec1.256p.jpg,Full,,ATX,Black / White,ATX 3.x
be quiet! Pure Power 13 M,750,159.0,80+ Gold,be quiet pure power 13 m,A,Excellent noise profile.,119.7,https://m.media-amazon.com/images/I/51NcpqwxV1L.jpg,Full,,ATX,Black,ATX 3.x
Super Flower Leadex III Gold UP,850,159.0,80+ Gold,super flower leadex iii gold up atx 3 1 ge,A,"850W has weak 3.3V transient response, but otherwise works well. 1000W seems to lack proper efficiency certifications, but meets gold criteria.",119.95,//cdna.pcpartpicker.com/static/forever/images/product/72e79c9c6bb8b0b3bf0eba2806d3142b.256p.jpg,Full,,ATX,Black,ATX 3.x
Super Flower Zillion FG,1050,159.0,80+ Gold,super flower zillion fg gold atx 3 1,B-*,,129.65,//cdna.pcpartpicker.com/static/forever/images/product/7ca08574210884ec7e77eb2fbd3dc92f.256p.jpg,Full,,ATX,Black,ATX 3.x
SeaSonic G12 GM,750,159.0,80+ Gold,seasonic g12 gm,C+,Semi-modular version of the G12 GC (Global),127.25,//cdna.pcpartpicker.com/static/forever/images/product/fb317ca4f40a87d0c432cde60e802884.256p.jpg,Semi,,ATX,Black / Blue,ATX 2.x
Thermaltake Toughpower GF A3 ATX 3.0,750,159.08,80+ Gold,thermaltake toughpower gf a3 swap fagu l,B-,"Unnanounced OEM swap. Technically invalid 80 Plus certification, but did qualify for Gold in testing, as advertised.",127.5,https://m.media-amazon.com/images/I/416+kN5iLdL.jpg,Full,,ATX,Black,ATX 3.x
Thermaltake Smart BM3,650,160.36,80+ Bronze,thermaltake smart bm3,C,"Transient response was tested but values were left out. OPP is set very high, but the PSU handled it and shut down safely and properly.",128.55,//cdna.pcpartpicker.com/static/forever/images/product/4f3b7e2fa6212bc5d7addadf36fa2b1b.256p.jpg,Semi,,ATX,Black,ATX 3.x
Corsair RM850e (2025),850,161.0,,No Match,N/A,No Match Info,0,//cdna.pcpartpicker.com/static/forever/images/product/3fa3c80c1defc487364f6bdaf2670b1e.256p.jpg,Full,,ATX,Black,N/A
be quiet! Pure Power 13 M,650,161.0,80+ Gold,be quiet pure power 13 m,B+,"85C bulk caps, excellent noise profile.",119.7,https://m.media-amazon.com/images/I/418l1crumuL.jpg,Full,,ATX,Black,ATX 3.x
Gigabyte UD850GM,850,161.0,80+ Gold,gigabyte  ud gm,B+,"Updated version of the P-GM. Decent overall performance, but component quality leaves a bit to be desired (especially the fan.)",101.03333333333333,//cdna.pcpartpicker.com/static/forever/images/product/2fd893bbd3486b3f2878a98bb949e0bb.256p.jpg,Full,,ATX,Black,ATX 2.x
Silverstone Triton 1000Rz,1000,162.0,,No Match,N/A,No Match Info,0,https://m.media-amazon.com/images/I/41IzqgaMa6L.jpg,Full,,ATX,Black,N/A
Thermaltake Smart,600,162.7,80+,thermaltake smart white label,F,"Black casing, white sticker. Unknown number of suppliers for this unit. Versions that have been tested have malfunctioning OCP, OPP, and SCP.",136.45,https://images-eu.ssl-images-amazon.com/images/I/51Ih1TB6nFL.jpg,No,,ATX,,ATX 2.x
Asus TUF Gaming 650B,650,162.79,80+ Bronze,asus tuf bronze,B,Mediocre transient response and low quality caps.,97.31521739130434,//cdna.pcpartpicker.com/static/forever/images/product/c45515b02278f53f5cd95192d5c57444.256p.jpg,No,,ATX,Black,ATX 2.x
be quiet! SFX Power 3 450,450,163.07,80+ Bronze,be quiet sfx power 3,C*,No information.,117.5,//cdna.pcpartpicker.com/static/forever/images/product/6f22b32ac4c2844cc76bbee6ef798d01.256p.jpg,No,,SFX,Black,ATX 2.x
NZXT C1000 (2024),1000,165.0,80+ Gold,nzxt c series gold atx 3 1 2024,A+,Available in black and white,106.29285714285714,//cdna.pcpartpicker.com/static/forever/images/product/a1414d14d663ac501c33db5a05fa5560.256p.jpg,Full,,ATX,White,ATX 3.x
Silverstone Extreme Rz,550,165.0,80+ Gold,silverstone extreme sfx sfx l rz gold,B*,"12V-2x6 connector on modular panel, but no included cable for it. Can be bought separately. Potentially to only need 150% excursions?",129.6,https://m.media-amazon.com/images/I/41+tayDSddL.jpg,Full,,SFX,Black,ATX 3.x
GameMax GX Pro Rampage,1050,165.0,80+ Platinum,No Match,N/A,No Match Info,0,/static/forever/img/no-image.png,Full,,ATX,Black,N/A
GameMax GX Pro Rampage,850,165.0,80+ Gold,galax omega glx,B*,No transient response testing found.,78.20945945945945,https://m.media-amazon.com/images/I/41F1AZeSYhL.jpg,Full,,ATX,White,ATX 3.x
KOLINK Regulator,850,167.0,80+ Gold,kolink regulator,B+*,Platform is well reviewed but nothing regarding electrical performance or protections data are out.,128.3,//cdna.pcpartpicker.com/static/forever/images/product/4f1f00d5a39a77d4f345c22a42556673.256p.jpg,Full,,ATX,Black,ATX 3.x
Antec CSK,750,167.07,80+ Bronze,antec atom cuprum strike csk h bronze,E,,117.85,//cdna.pcpartpicker.com/static/forever/images/product/212d4988bf00a133481f4d2c997624f3.256p.jpg,Semi,,ATX,Black / Yellow,ATX 2.x
SeaSonic SSP-300TBS,300,167.88,80+ Bronze,No Match,N/A,No Match Info,0,//cdna.pcpartpicker.com/static/forever/images/product/e3cb8b7db9545858119bfa7620a14226.256p.jpg,No,,TFX,Silver,N/A
Xilence XP750R10,750,167.94,80+ Bronze,xilence gaming bronze,E,"Claims to be DC-DC, but internal shots show otherwise; false advertising.",87.91956521739131,https://m.media-amazon.com/images/I/41aRAw2wd7L.jpg,No,,ATX,Black / Red,ATX 2.x
Thermaltake Smart,500,168.0,80+,thermaltake smart white label,F,"Black casing, white sticker. Unknown number of suppliers for this unit. Versions that have been tested have malfunctioning OCP, OPP, and SCP.",136.45,https://m.media-amazon.com/images/I/519RlzaoKDL.jpg,No,,ATX,,ATX 2.x
Xilence XP850R10,850,168.75,80+ Bronze,xilence gaming bronze,E,"Claims to be DC-DC, but internal shots show otherwise; false advertising.",87.91956521739131,https://m.media-amazon.com/images/I/41aRAw2wd7L.jpg,No,,ATX,Black / Red,ATX 2.x
MSI MAG A650GL,650,169.0,80+ Gold,msi mag a gl,B,,102.71538461538461,//cdna.pcpartpicker.com/static/forever/images/product/9fd701005a49816e85072d6ed79c2951.256p.jpg,Full,,ATX,Black,ATX 2.x
Corsair RM750x (2024),750,169.0,,No Match,N/A,No Match Info,0,//cdna.pcpartpicker.com/static/forever/images/product/e78e01bbb56c5608fe37fc45d2fcb2b5.256p.jpg,Full,,ATX,Black,N/A
SeaSonic CORE GX ATX 3 (2024),650,169.0,80+ Gold,seasonic core gx atx 3 0,B-,"Good electrical performance and decent component quality, however OCP on the minor rails is set way too high, particularly on 5VSB (over 200%)",149.2,//cdna.pcpartpicker.com/static/forever/images/product/5c6f5c52e83c261e3ae443289bc7a5a4.256p.jpg,Full,,ATX,Black,ATX 3.x
FSP Group FSP300-57FCB,300,169.0,80+ Gold,No Match,N/A,No Match Info,0,//cdna.pcpartpicker.com/static/forever/images/product/4abcee7b7ea5902ff86c66a848faae82.256p.jpg,Full,,Flex ATX,Black,N/A
SeaSonic FOCUS,550,169.0,80+ Gold,seasonic focus gold gm,A,Some units produced before 2018 may experience shutdowns with high transient draw GPUs.,125.45,//cdna.pcpartpicker.com/static/forever/images/product/75b684ec2b63c2ed4f3df634d0f6ac5f.256p.jpg,Semi,,ATX,Black,ATX 2.x
ENDORFY Vero L5,700,169.39,80+ Bronze,endorfy vero l6,C+,"Good electrical performance for the category, decent component quality, protections are set reasonably.",122.58333333333333,//cdna.pcpartpicker.com/static/forever/images/product/d2e2490a078d64e82a1181d7e43afa05.256p.jpg,No,,ATX,Black,ATX 3.x
Xilence XP750R12.ARGB,750,171.54,80+ Gold,xilence gaming gold,C*,"Claims meeting 80+ Gold requirements, not certified.",94.36666666666666,https://m.media-amazon.com/images/I/41rcjMiID3L.jpg,No,,ATX,Black,ATX 2.x
Silverstone Triton 1000Rz,1000,176.0,,No Match,N/A,No Match Info,0,https://m.media-amazon.com/images/I/41lQO0hmwCL.jpg,Full,,ATX,White,N/A
Gigabyte UD-GM PG5,850,177.0,80+ Gold,gigabyte  ud gm pg5 v2,C+,"Various issues including low PF, poor excursion response, and terrible vampire power suppression. OCP is set sky-high on the minor rails.",129.05,//cdna.pcpartpicker.com/static/forever/images/product/71a63db2267f43304efa03516e480eb1.256p.jpg,Full,,ATX,White,ATX 3.x
Corsair RM750e (2023),750,178.0,80+ Gold,corsair rm e 2023 gen 5,B+,,115.06666666666666,//cdna.pcpartpicker.com/static/forever/images/product/336c7955df0312d04655dd3a13973c95.256p.jpg,Full,,ATX,Black,ATX 3.x
Thermaltake Smart,700,178.1,80+,thermaltake smart white label,F,"Black casing, white sticker. Unknown number of suppliers for this unit. Versions that have been tested have malfunctioning OCP, OPP, and SCP.",136.45,//cdna.pcpartpicker.com/static/forever/images/product/4bd3b198fbff9c55cc45e640e9ce8ed0.256p.jpg,No,,ATX,,ATX 2.x
NZXT C1200 (2024),1200,179.0,80+ Gold,nzxt c series gold atx 3 1 2024,A+,Available in black and white,106.29285714285714,//cdna.pcpartpicker.com/static/forever/images/product/c738e40268a79b636c158d4532785b6d.256p.jpg,Full,,ATX,Black,ATX 3.x
Silverstone TX500-G,500,179.0,80+ Gold,No Match,N/A,No Match Info,0,//cdna.pcpartpicker.com/static/forever/images/product/4d14c9693624095ceaf52d8afe50282d.256p.jpg,No,,TFX,Black,N/A
Thermaltake Toughpower GF1 ARGB,750,179.0,80+ Gold,thermaltake toughpower gf1 argb,A+,,128.05,//cdna.pcpartpicker.com/static/forever/images/product/1c8de6a74ea9a52f3ad7f11dfad34751.256p.jpg,Full,,ATX,,ATX 2.x
Asus Prime AP-850G,850,180.0,80+ Gold,asus prime gold,B+,,128.5,//cdna.pcpartpicker.com/static/forever/images/product/78e68f418ed5b6051e6e7204102d7094.256p.jpg,Full,,ATX,White / Black,ATX 3.x
Enermax REVOLUTION III,850,180.32,80+ Gold,enermax revolution iii,A*,"Internal shots are promising, but further testing is needed before tiering.",129.6,https://m.media-amazon.com/images/I/312XPF0wTxL.jpg,Full,,ATX,Black / Gold,ATX 3.x
Silverstone SX-G,700,183.0,80+ Gold,silverstone sfx sx gold sx g new,B-,"Two samples (same platform) no longer operated after protections testing per LTT Labs , which is not ideal, but all protections did function.",128.45,//cdna.pcpartpicker.com/static/forever/images/product/dae466078494c93df86edd455e9094e8.256p.jpg,Full,,SFX,Black,ATX 2.x
be quiet! Power Zone 2,750,184.0,80+ Platinum,be quiet power zone 2,B+,First be quiet! PSU with semi-passive operation.,119.55,//cdna.pcpartpicker.com/static/forever/images/product/d04914d2e55a2b07e07ab7e5ddb1c6e9.256p.jpg,Full,,ATX,Black,ATX 3.x
KOLINK Regulator,1200,184.0,80+ Gold,kolink regulator,B+*,Platform is well reviewed but nothing regarding electrical performance or protections data are out.,128.3,//cdna.pcpartpicker.com/static/forever/images/product/aee3e63cea11896da7ff42a3999a0079.256p.jpg,Full,,ATX,Black,ATX 3.x
Montech CENTURY II,1050,185.0,80+ Gold,montech century ii gold atx 3 1,A,"Good performance and noise profile. High inrush current. OPP and OCP on the minor rails need tuning. Functional, but set high.",129.9,//cdna.pcpartpicker.com/static/forever/images/product/c04beca6c6820e5b4fe612ab1850b8cd.256p.jpg,Full,,ATX,Black,ATX 3.x
Asus ROG LOKI,750,187.0,80+ Platinum,asus rog loki platinum,A,Not to be confused with the Xigmatek Loki,128.1,//cdna.pcpartpicker.com/static/forever/images/product/0e997c3c3c311e827733420a531bf5c9.256p.jpg,Full,,SFX,Black / Silver,ATX 3.x
Thermaltake Smart BM3,750,187.2,80+ Bronze,thermaltake smart bm3,C,"Transient response was tested but values were left out. OPP is set very high, but the PSU handled it and shut down safely and properly.",128.55,//cdna.pcpartpicker.com/static/forever/images/product/59a8ac87b700bbb5773a2740925f47c1.256p.jpg,Semi,,ATX,Black,ATX 3.x
Asus TUF Gaming 850G,850,187.47,80+ Gold,asus tuf gold,B,12VHPWR to dual PCIE cable as well as a native 12VHPWR cable.,127.9,//cdna.pcpartpicker.com/static/forever/images/product/4f699d87a43e3c59ea964a1bf230301c.256p.jpg,Full,,ATX,Black,ATX 3.x
SeaSonic FOCUS Gold,650,188.0,80+ Gold,seasonic focus gold gm,A,Some units produced before 2018 may experience shutdowns with high transient draw GPUs.,125.45,https://m.media-amazon.com/images/I/517yubmYSHS.jpg,Semi,,ATX,,ATX 2.x
SeaSonic FOCUS GX,550,188.94,80+ Gold,seasonic focus gx,A,,126.35,//cdna.pcpartpicker.com/static/forever/images/product/a39289b41b92d2d387a165aca1af3c9d.256p.jpg,Full,,ATX,Black,ATX 2.x
Corsair RM850x (2024),850,189.0,,No Match,N/A,No Match Info,0,//cdna.pcpartpicker.com/static/forever/images/product/1e3308cded9a7c92a8dba6b2be976bcc.256p.jpg,Full,,ATX,Black,N/A
Lian Li EDGE GOLD,850,189.0,80+ Gold,lian li edge eg gold,A,German bulk caps; dual-chamber L-shape design; modular inputs on the main PCB. 1000W and up models come with a USB/fan hub.,128.75,//cdna.pcpartpicker.com/static/forever/images/product/9a5971cefd086b73cf477e550aed363a.256p.jpg,Full,,ATX,Black,ATX 3.x
ADATA XPG Core Reactor II,850,189.0,80+ Gold,adata xpg core reactor ii,A+,ATX 3.0 refresh,128.75,//cdna.pcpartpicker.com/static/forever/images/product/c47f1c0603362227e6188fda6f81c067.256p.jpg,Full,,ATX,Black,ATX 3.x
GameMax GX Pro Rampage,1250,189.0,80+ Platinum,No Match,N/A,No Match Info,0,/static/forever/img/no-image.png,Full,,ATX,White,N/A
BitFenix Whisper M,850,189.0,80+ Gold,bitfenix whisper m,A,,124.9,//cdna.pcpartpicker.com/static/forever/images/product/decd68c8740d76412208eee39fef9b59.256p.jpg,Full,,ATX,,ATX 2.x
SeaSonic FOCUS Gold,550,193.0,80+ Gold,seasonic focus gold gm,A,Some units produced before 2018 may experience shutdowns with high transient draw GPUs.,125.45,//cdna.pcpartpicker.com/static/forever/images/product/507fd1be4dc10d82b1dce8f519e666fb.256p.jpg,Semi,,ATX,,ATX 2.x
KOLINK Regulator,1000,194.0,80+ Gold,kolink regulator,B+*,Platform is well reviewed but nothing regarding electrical performance or protections data are out.,128.3,//cdna.pcpartpicker.com/static/forever/images/product/0bd90d63bd08ff1727b0f6eae0c5c89f.256p.jpg,Full,,ATX,Black,ATX 3.x
Thermaltake Smart W3,700,194.6,80+,thermaltake smart w3,C-*,May be double-sourced (at least) for other markets.,129.0,//cdna.pcpartpicker.com/static/forever/images/product/cd64e71ae0902ee715c7d695b32eb0aa.256p.jpg,No,,ATX,Black,ATX 3.x
NZXT C (2019),650,197.9,80+ Gold,nzxt c series gold v1 2019,A,Fan grille with islands above the fan hub and for fan mounting holes. 120mm fan,146.4,//cdna.pcpartpicker.com/static/forever/images/product/801406fa0cd02e64085d789fd7a0fd7d.256p.jpg,Full,,ATX,Black,ATX 2.x
Enermax REVOLUTION III,750,198.13,80+ Gold,enermax revolution iii,A*,"Internal shots are promising, but further testing is needed before tiering.",129.6,https://m.media-amazon.com/images/I/31bClvcBPSL.jpg,Full,,ATX,Black / Gold,ATX 3.x
Lian Li EDGE GOLD,850,199.0,80+ Gold,lian li edge eg gold,A,German bulk caps; dual-chamber L-shape design; modular inputs on the main PCB. 1000W and up models come with a USB/fan hub.,128.75,//cdna.pcpartpicker.com/static/forever/images/product/f3d49f21c4bbc671af07e2be31f23b94.256p.jpg,Full,,ATX,White,ATX 3.x
Montech CENTURY II,1200,199.0,80+ Gold,montech century ii gold atx 3 1,A,"Good performance and noise profile. High inrush current. OPP and OCP on the minor rails need tuning. Functional, but set high.",129.9,//cdna.pcpartpicker.com/static/forever/images/product/f973a0374020c80c5fb0199771036a12.256p.jpg,Full,,ATX,Black,ATX 3.x
NZXT C1000 Core,1000,199.0,80+ Gold,nzxt c series gold core atx 3 1 2025,A,Excellent noise profile.,104.9,https://m.media-amazon.com/images/I/41DQWFmQQQL.jpg,Full,,ATX,Black,ATX 3.x
Silverstone TX700-G,700,199.0,80+ Gold,No Match,N/A,No Match Info,0,//cdna.pcpartpicker.com/static/forever/images/product/7e9ddc1020c497683a9264ffe821dc2d.256p.jpg,No,,TFX,Black,N/A
Silverstone HELA 1300R,1300,199.0,80+ Platinum,silverstone hela r platinum har pm,A,,103.41052631578948,https://m.media-amazon.com/images/I/41P2yKkAkJL.jpg,Full,,ATX,Black,ATX 3.x
Montech TITAN PLA,850,199.0,80+ Platinum,montech titan platinum pla,A-,"Very good build quality and efficiency, but overall performance is dwarfed by the CWT-built Titan Gold.",129.3,//cdna.pcpartpicker.com/static/forever/images/product/82e5b78b3a3350f267109a937680844e.256p.jpg,Full,,ATX,White,ATX 3.x
Cooler Master GX III GOLD,650,199.0,80+ Gold,cooler master gx iii gold atx 3 1,B+,"GX III ATX 3.0, but upd. to ATX 3.1. Yate Loon rifle-bearing. Has purple heatsinks for glam.",129.0,https://m.media-amazon.com/images/I/41HYwATn-VL.jpg,Full,,ATX,Black / Purple,ATX 3.x
be quiet! TFX Power 3 300,300,200.47,80+ Gold,No Match,N/A,No Match Info,0,//cdna.pcpartpicker.com/static/forever/images/product/26f4e1e59c28ce6c0a4dd6e61845d41a.256p.jpg,No,,TFX,Black,N/A
Corsair RM1000e (2025),1000,201.32,,No Match,N/A,No Match Info,0,//cdna.pcpartpicker.com/static/forever/images/product/e1a0bb0ca24bc0c2d95fea57a8c2019d.256p.jpg,Full,,ATX,Black,N/A
Xilence XP750MR9.2,750,201.54,80+ Gold,xilence gaming gold,C*,"Claims meeting 80+ Gold requirements, not certified.",24.36666666666666,https://m.media-amazon.com/images/I/51bWmYATNiL.jpg,Semi,,ATX,Black / Red,ATX 2.x
SHARKOON SilentStorm,500,202.93,80+ Gold,sharkoon silentstorm sfx gold,B,,114.7,https://m.media-amazon.com/images/I/41pfxZbEuKL.jpg,Full,,SFX,Black,ATX 2.x
Silverstone SX750-PT,750,203.0,80+ Platinum,silverstone sfx l sx lpt,F,"Numerous issues capped off by malfunctioning OPP that either doesn't exist or is set way too high, which caused the unit to explode.",102.47272727272728,https://m.media-amazon.com/images/I/41suN4vTHcL.jpg,Full,,SFX,Black,ATX 2.x
Asus TUF Gaming 750G,750,205.49,80+ Gold,asus tuf gold,B,12VHPWR to dual PCIE cable as well as a native 12VHPWR cable.,127.9,//cdna.pcpartpicker.com/static/forever/images/product/45c889b358290996d7737156b64146c0.256p.jpg,Full,,ATX,Black,ATX 3.x
Enermax Revolution D.F. 12,750,206.2,80+ Gold,enermax revolution d f 12,A-,122mm depth (extremely compact.),129.25,https://m.media-amazon.com/images/I/41zqr-GqL1L.jpg,Full,,ATX,Black,ATX 3.x
Thermaltake Toughpower GT,750,206.65,80+ Gold,thermaltake toughpower gt version a fnfag 1,B-*,Circular fan grille; no info aside from internal shots from Thermaltake. Likely even more costdown A07B.,130.15,//cdna.pcpartpicker.com/static/forever/images/product/6914f8a3ed878aae940965c45a0799d4.256p.jpg,Full,,ATX,Black,ATX 3.x
Rosewill VSB,650,206.9,80+ Bronze,rosewill vsb,C,"Internal shots show the unit using the same ""ICB"" (in reality rifle bearing) fan as the SilverStone Triton Rx.",129.1,//cdna.pcpartpicker.com/static/forever/images/product/e12bec22ce3376a2356f504366ad1d8b.256p.jpg,Semi,,ATX,Black,ATX 3.x
Lian Li SX0850P,850,207.0,80+ Platinum,lian li sx p,A,Good electrical performance and reasonably quiet for the category.,103.17407407407407,//cdna.pcpartpicker.com/static/forever/images/product/a3404283ef1a9e46512f4acf11cb7247.256p.jpg,Full,,ATX,White,ATX 3.x
Thermaltake Toughpower SFX,650,207.0,80+ Gold,thermaltake toughpower sfx new premium,B*,Insufficient protections data to confirm tiering.,128.4,//cdna.pcpartpicker.com/static/forever/images/product/a394c8ef0106b65b6cf0c18d39278184.256p.jpg,Full,,SFX,Black,ATX 2.x
Silverstone Essential,550,207.39,80+ Bronze,silverstone strider essential st ef,E,,129.25,//cdna.pcpartpicker.com/static/forever/images/product/8e362f9250f1d0c8a620e58dc740c14a.256p.jpg,No,,ATX,Black,ATX 2.x
Corsair RM750x SHIFT,750,208.0,80+ Gold,corsair rm x shift 2025,A+,Semi-digital. Very good noise profile and electrical performance. 5VSB OCP is set quite high.,48.87368421052632,//cdna.pcpartpicker.com/static/forever/images/product/538f621aadcabc4d3a2a09a02d4df153.256p.jpg,Full / Side,,ATX,White,ATX 3.x
Cooler Master V SFX Gold ATX 3.0,750,208.0,80+ Gold,cooler master v series vanguard gold sfx atx 3 0,A,Basically G1278 updated to ATX 3.0,129.75,https://m.media-amazon.com/images/I/51UzryVRTWL.jpg,Full,,SFX,White,ATX 3.x
SeaSonic CORE GX ATX 3 (2024),850,209.0,80+ Gold,seasonic core gx atx 3 0,B-,"Good electrical performance and decent component quality, however OCP on the minor rails is set way too high, particularly on 5VSB (over 200%)",149.2,//cdna.pcpartpicker.com/static/forever/images/product/2a8c5efeb85017829c46d8fe18d71ca6.256p.jpg,Full,,ATX,Black,ATX 3.x
SeaSonic FOCUS,650,209.0,80+ Gold,seasonic focus gold gm,A,Some units produced before 2018 may experience shutdowns with high transient draw GPUs.,125.45,//cdna.pcpartpicker.com/static/forever/images/product/61fd756ed93dcc648720f04f7a7d21c5.256p.jpg,Semi,,ATX,Black,ATX 2.x
SeaSonic 750FX WHITE,750,209.0,80+ Gold,seasonic focus gx white,A,,100.00294117647059,//cdna.pcpartpicker.com/static/forever/images/product/189110bb4c0e386f44dfcf9105049e43.256p.jpg,Full,,ATX,White,ATX 2.x
SeaSonic CORE GX ATX 3 (2024),750,210.0,80+ Gold,seasonic core gx atx 3 0,B-,"Good electrical performance and decent component quality, however OCP on the minor rails is set way too high, particularly on 5VSB (over 200%)",149.2,//cdna.pcpartpicker.com/static/forever/images/product/0c0d62393e77cdf888840f591ae503e5.256p.jpg,Full,,ATX,Black,ATX 3.x
Gigabyte AORUS ELITE P850 ICE,850,211.0,80+ Platinum,gigabyte aorus elite ae pm pg5 ice,A-,The OCP triggering point on the 5VSB rail allows for extremely excessive ripple; 5V rail hot triggering point allows for a voltage drop out of spec.,110.26603773584905,//cdna.pcpartpicker.com/static/forever/images/product/bdd5830e0a2fbcfb5afeefae21121053.256p.jpg,Full,,ATX,White,ATX 3.x
SeaSonic FOCUS,750,211.0,80+ Gold,seasonic focus gold gm,A,Some units produced before 2018 may experience shutdowns with high transient draw GPUs.,125.45,//cdna.pcpartpicker.com/static/forever/images/product/d4feddde3614ba86aa36c6ec23750d99.256p.jpg,Semi,,ATX,Black,ATX 2.x
be quiet! Pure Power 13 M,1000,212.0,80+ Gold,be quiet pure power 13 m,A,Excursion response in the 200% test could be better compared to other units in its class. Excellent noise profile.,119.7,https://m.media-amazon.com/images/I/51NcpqwxV1L.jpg,Full,,ATX,Black,ATX 3.x
Corsair CX750M (2021),750,212.9,80+ Bronze,corsair cx m 2021 black label,C+,,114.36666666666666,//cdna.pcpartpicker.com/static/forever/images/product/e3f5e5e966e562c1ec685b17ed83bccb.256p.jpg,Semi,,ATX,Black,ATX 2.x
Corsair RM850,850,213.95,80+ Gold,corsair rm 2021 black,B+,Triangular fan grille perforations. Hong Hua rifle bearing fan. Performance is assumed to be the same as 2019 version.,147.3,//cdna.pcpartpicker.com/static/forever/images/product/1752baa3ddb162df098cf33b0b6eeae3.256p.jpg,Full,,ATX,White / Black,ATX 2.x
Gigabyte UD-GM PG5,750,214.02,80+ Gold,gigabyte  ud gm pg5 v2,C+,"Various issues including low PF, poor excursion response, and terrible vampire power suppression. OCP is set sky-high on the minor rails.",129.05,//cdna.pcpartpicker.com/static/forever/images/product/49197507b4f14b631967e6162e757357.256p.jpg,Full,,ATX,Black,ATX 3.x
Montech APX,750,214.32,80+,montech apx,C-,,128.55,https://m.media-amazon.com/images/I/41cEcVaK0QL.jpg,No,,ATX,Black,ATX 2.x
SeaSonic FOCUS Plus 750 Gold,750,215.0,80+ Gold,seasonic focus plus gold gx,A,,125.7,//cdna.pcpartpicker.com/static/forever/images/product/382627d6b0a36162931db13af716ef18.256p.jpg,Full,,ATX,,ATX 2.x
GameMax GX Pro Rampage,1050,217.0,80+ Platinum,No Match,N/A,No Match Info,0,https://m.media-amazon.com/images/I/418AZyebkUL.jpg,Full,,ATX,White,N/A
