NZXT C750 Core,750,139.99,80+ Gold,nzxt c series gold core atx 3 1 2025,A-*,"Excellent noise profile. 300W 12V-2x6. Barely >50mV 12V under 110% overload, need internal shots before tiering.",108.1608695652174,https://m.media-amazon.com/images/I/41n2LafaCzL.jpg,Full,,ATX,Black,ATX 3.x
SAMA P850,850,139.99,80+ Platinum,sama p,A,"The OCP and OPP triggering points need tuning. Very good ripple suppression, and decent component quality. Excellent noise profile.",108.8,//cdna.pcpartpicker.com/static/forever/images/product/094e2ca39eb6ed99bc2035c11fef78f5.256p.jpg,Full,,ATX,Black,ATX 3.x
Super Flower Zillion FG,1250,139.99,80+ Gold,super flower zillion fg gold atx 3 1,B-*,,129.65,//cdna.pcpartpicker.com/static/forever/images/product/d8adb266604520991852450e39838d13.256p.jpg,Full,,ATX,Black,ATX 3.x
Fractal Design Ion+ 560P,560,139.99,80+ Platinum,fractal design ion platinum plus 2,A,,106.0048780487805,//cdna.pcpartpicker.com/static/forever/images/product/c2a8cbfae3cc72e34af4e829d2d77e32.256p.jpg,Full,,ATX,Black,ATX 2.x
Apevia Prestige,800,140.9,80+ Gold,apevia prestige atx 3 0,C+*,"No OTP claimed, no performance or protections data",128.65,https://m.media-amazon.com/images/I/41WXywVNWGL.jpg,No,,ATX,Black,ATX 3.x
Thermaltake Toughpower GT,850,142.45,80+ Gold,thermaltake toughpower gt version a fnfag 1,B-*,Circular fan grille; no info aside from internal shots from Thermaltake. Likely even more costdown A07B.,130.15,//cdna.pcpartpicker.com/static/forever/images/product/e75330e2013e0c36c9f33df731683563.256p.jpg,Full,,ATX,White,ATX 3.x
MSI MAG A850GN PCIE5,850,142.45,80+ Gold,msi mag a gn pcie5,C+*,"Need better internal shots to confirm platform, sleeve bearing fan according to specifications.",108.37368421052632,//cdna.pcpartpicker.com/static/forever/images/product/d884f89ec7da8de495ecab61eda6547e.256p.jpg,No,,ATX,Black,ATX 3.x
Chieftec GPS-700A8,700,142.79,80+ Bronze,chieftec chieftronic vita bpx s,C-,"3 year warranty; 85C bulk cap, and not one of particularly good quality, either.",81.08846153846154,https://m.media-amazon.com/images/I/51VLmzhKl1L.jpg,No,,ATX,Black / White,ATX 2.x
Segotep GM,850,143.97,80+ Gold,segotep gm,F,Numerous protections malfunctions and terrible electrical performance. See testing here .,126.5,https://m.media-amazon.com/images/I/51F777ShQDL.jpg,Full,,ATX,Black,ATX 3.x
Thermaltake Smart BX1 550,550,144.53,80+ Bronze,thermaltake smart bx1 dc dc ver,C-*,,129.55,https://images-na.ssl-images-amazon.com/images/I/41bUVbWjjVL.jpg,No,,ATX,Black,ATX 2.x
Asus Prime AP-850G,850,144.97,80+ Gold,asus prime gold,B+,,128.5,//cdna.pcpartpicker.com/static/forever/images/product/78e68f418ed5b6051e6e7204102d7094.256p.jpg,Full,,ATX,White / Black,ATX 3.x
ASRock Challenger CL-750B,750,144.98,80+ Bronze,asrock challenger bronze cl b pcie 5 1,C-*,"Does not claim ATX 3.x compliance, but 750W claims PCIE 5.1 ready w/ 450W 12V-2x6.",108.78888888888889,//cdna.pcpartpicker.com/static/forever/images/product/2e749fd4d8d5f2bab633401da1a0b3b4.256p.jpg,No,,ATX,Black,ATX 2.x
be quiet! Pure Power 12,850,144.99,80+ Gold,be quiet pure power 12,B*,"85C bulk caps, rifle bearing fan, non-modular.",118.6,//cdna.pcpartpicker.com/static/forever/images/product/b43737a5d4e955c807956044ec1b0f07.256p.jpg,No,,ATX,Black,ATX 3.x
ASRock Steel Legend SL-850G,850,146.29,80+ Gold,asrock steel legend sl g,A,"1000W model has poor transient response on 12V under 200% spike, other models mediocre. 850/1000W avail. in white.",124.85217391304349,//cdna.pcpartpicker.com/static/forever/images/product/32248606cf6d469a056d08373860c535.256p.jpg,Full,,ATX,Black,ATX 3.x
Silverstone SFX,450,146.88,80+ Bronze,silverstone extreme sfx sfx l bronze,C-,,119.8,https://images-eu.ssl-images-amazon.com/images/I/51YKrs7LtqL.jpg,No,,SFX,Black,ATX 2.x
Antec CSK,650,146.9,80+ Bronze,antec atom cuprum strike csk dc,C-,DC-DC variant of the CSK Bronze; only 750W has 300W 12VHPWR.,120.05,//cdna.pcpartpicker.com/static/forever/images/product/eaf88844dea83c9215031240a243a6b6.256p.jpg,No,,ATX,Black / Yellow,ATX 2.x
Lian Li EDGE GOLD,850,146.98,80+ Gold,lian li edge eg gold,A,German bulk caps; dual-chamber L-shape design; modular inputs on the main PCB. 1000W and up models come with a USB/fan hub.,128.75,//cdna.pcpartpicker.com/static/forever/images/product/9a5971cefd086b73cf477e550aed363a.256p.jpg,Full,,ATX,Black,ATX 3.x
Asus Prime,750,146.99,80+ Bronze,asus tuf bronze,B,Mediocre transient response and low quality caps.,84.89285714285714,//cdna.pcpartpicker.com/static/forever/images/product/ee8811f020d54929e60e22dfaff5219b.256p.jpg,No,,ATX,Black,ATX 2.x
MSI MAG A650GLS PCIE5,650,148.99,80+ Gold,msi mag a gls pcie5,A-,Minor rails' OCP is set lower compared to the CWT-built high-wattage models. 650W is noisier than the 750W on account of using a DBB fan.,109.45,//cdna.pcpartpicker.com/static/forever/images/product/b3f5ce174d631594ae9f8f2dc3b291d1.256p.jpg,Full,,ATX,Black,ATX 3.x
Inter-Tech Argus RGB CM II,650,149.22,80+ Gold,No Match,N/A,No Match Info,0,//cdna.pcpartpicker.com/static/forever/images/product/d0ad7042434a80974e32f22883483a2f.256p.jpg,Semi,,ATX,Black,N/A
Thermaltake Smart BX1 650,650,149.78,80+ Bronze,thermaltake smart bx1 dc dc ver,C-*,,129.55,https://images-na.ssl-images-amazon.com/images/I/41oykKKWjkL.jpg,No,,ATX,Black,ATX 2.x
ASRock Steel Legend SL-1000G,1000,149.94,80+ Gold,asrock steel legend sl g,A,"1000W model has poor transient response on 12V under 200% spike, other models mediocre. 850/1000W avail. in white.",124.85217391304349,//cdna.pcpartpicker.com/static/forever/images/product/0831b235eea9461d59da3b218e57f673.256p.jpg,Full,,ATX,Black,ATX 3.x
be quiet! Power Zone 2,750,149.99,80+ Platinum,be quiet power zone 2,B+,First be quiet! PSU with semi-passive operation.,119.55,//cdna.pcpartpicker.com/static/forever/images/product/d04914d2e55a2b07e07ab7e5ddb1c6e9.256p.jpg,Full,,ATX,Black,ATX 3.x
Rosewill CMG850,850,149.99,80+ Gold,rosewill cmg,B*,,116.48888888888888,https://m.media-amazon.com/images/I/41kpwyrL88L.jpg,Full,,ATX,Black,ATX 2.x
SAMA P1000,1000,149.99,80+ Platinum,sama p,A,"The OCP and OPP triggering points need tuning. Very good ripple suppression, and decent component quality. Excellent noise profile.",108.8,//cdna.pcpartpicker.com/static/forever/images/product/fbebaefeeb7bd91d2612b0570331251b.256p.jpg,Full,,ATX,Black,ATX 3.x
SAMA P1000,1000,149.99,80+ Platinum,sama p,A,"The OCP and OPP triggering points need tuning. Very good ripple suppression, and decent component quality. Excellent noise profile.",108.8,//cdna.pcpartpicker.com/static/forever/images/product/7d2c4da5438062bd5da6f55782d76e34.256p.jpg,Full,,ATX,White,ATX 3.x
Fractal Design Ion+ 660P,660,149.99,80+ Platinum,fractal design ion platinum plus 2,A,,106.0048780487805,//cdna.pcpartpicker.com/static/forever/images/product/858613a28125fded4ae29e8fe2659158.256p.jpg,Full,,ATX,Black,ATX 2.x
Xilence XP750R6.2,750,151.44,80+,xilence performance a xp r5,E,,82.68333333333334,https://m.media-amazon.com/images/I/41pKUI+XyJL.jpg,No,,ATX,Black,ATX 2.x
Xilence XP500R6,500,152.86,,No Match,N/A,No Match Info,0,//cdna.pcpartpicker.com/static/forever/images/product/7cfc7e81a5e3b77b4d14ca3b214cb406.256p.jpg,No,,ATX,Black / Red,N/A
SHARKOON SilentStorm,450,153.66,80+ Bronze,sharkoon silentstorm sfx bronze,E,EU/JP only? No stated manufacturer warranty outside of mandated EU 2 year warranty.,115.05,https://m.media-amazon.com/images/I/51cuL3T5ODL.jpg,No,,SFX,Black,ATX 2.x
Xilence XP650R10,650,153.68,80+ Bronze,xilence gaming bronze,E,"Claims to be DC-DC, but internal shots show otherwise; false advertising.",87.91956521739131,https://m.media-amazon.com/images/I/41t3xwRrTwL.jpg,No,,ATX,Black / Red,ATX 2.x
Asus Prime AP-750G,750,153.99,80+ Gold,asus prime gold,B+,,128.5,//cdna.pcpartpicker.com/static/forever/images/product/72b335278eb86295c6d48f3b1794efa5.256p.jpg,Full,,ATX,White / Black,ATX 3.x
be quiet! TFX Power 3 300,300,154.94,80+ Gold,No Match,N/A,No Match Info,0,//cdna.pcpartpicker.com/static/forever/images/product/26f4e1e59c28ce6c0a4dd6e61845d41a.256p.jpg,No,,TFX,Black,N/A
Corsair RM850e (2025),850,154.99,,No Match,N/A,No Match Info,0,//cdna.pcpartpicker.com/static/forever/images/product/3fa3c80c1defc487364f6bdaf2670b1e.256p.jpg,Full,,ATX,Black,N/A
be quiet! Pure Power 13 M,850,154.99,80+ Gold,be quiet pure power 13 m,A,Excellent noise profile.,119.7,https://m.media-amazon.com/images/I/51NcpqwxV1L.jpg,Full,,ATX,Black,ATX 3.x
Corsair RM750e (2025),750,154.99,,No Match,N/A,No Match Info,0,//cdna.pcpartpicker.com/static/forever/images/product/3b9e84b0c082af2c8d1beed2698c3a69.256p.jpg,Full,,ATX,White,N/A
SeaSonic Focus GX V4 ATX 3 (2024),750,155.1,80+ Gold,seasonic focus gx v4 atx 3 1,A-,"Black model has white line accents, compared to V3. Stupidly high inrush current, mediocre transient response, minor rails' OCP need tuning.",149.4,//cdna.pcpartpicker.com/static/forever/images/product/5595266ca881fcc6e5296037a601f47d.256p.jpg,Full,,ATX,Black,ATX 3.x
ASRock Phantom Gaming PG-750G,750,156.16,80+ Gold,asrock phantom gaming pg g,A,"12V-2x6 connector (GPU side) has thermistors to act as an ""OTP"" against melting. Stellar ripple suppression, especially on the minor rails.",125.3,//cdna.pcpartpicker.com/static/forever/images/product/05f77e3fcfaedb40ed55bfa5174d914e.256p.jpg,Full,,ATX,Black,ATX 3.x
SeaSonic Focus GX V4 ATX 3 (2024),850,156.2,80+ Gold,seasonic focus gx v4 atx 3 1,A-,"Black model has white line accents, compared to V3. Stupidly high inrush current, mediocre transient response, minor rails' OCP need tuning.",149.4,//cdna.pcpartpicker.com/static/forever/images/product/5595266ca881fcc6e5296037a601f47d.256p.jpg,Full,,ATX,Black,ATX 3.x
Asus TUF Gaming 750G,750,156.2,80+ Gold,asus tuf gold,B,12VHPWR to dual PCIE cable as well as a native 12VHPWR cable.,127.9,//cdna.pcpartpicker.com/static/forever/images/product/45c889b358290996d7737156b64146c0.256p.jpg,Full,,ATX,Black,ATX 3.x
Corsair CXM,750,159.04,80+ Bronze,corsair cx m 2021 black label,C+,,105.47777777777777,//cdna.pcpartpicker.com/static/forever/images/product/23a8f923c23d6de30026d889136bf175.256p.jpg,Semi,,ATX,,ATX 2.x
Corsair RM850,850,159.5,80+ Gold,corsair rm 2021 black,B+,Triangular fan grille perforations. Hong Hua rifle bearing fan. Performance is assumed to be the same as 2019 version.,147.3,//cdna.pcpartpicker.com/static/forever/images/product/1752baa3ddb162df098cf33b0b6eeae3.256p.jpg,Full,,ATX,White / Black,ATX 2.x
Corsair RM850x (2024),850,159.97,,No Match,N/A,No Match Info,0,//cdna.pcpartpicker.com/static/forever/images/product/1e3308cded9a7c92a8dba6b2be976bcc.256p.jpg,Full,,ATX,Black,N/A
ASRock PRO-850G,850,159.98,80+ Gold,asrock pro gold,B+*,,129.0,//cdna.pcpartpicker.com/static/forever/images/product/0e51258356f39bb394a673566948bcac.256p.jpg,No,,ATX,Black,ATX 3.x
Montech CENTURY II,1050,159.99,80+ Gold,montech century ii gold atx 3 1,A,"Good performance and noise profile. High inrush current. OPP and OCP on the minor rails need tuning. Functional, but set high.",129.9,//cdna.pcpartpicker.com/static/forever/images/product/c04beca6c6820e5b4fe612ab1850b8cd.256p.jpg,Full,,ATX,Black,ATX 3.x
NZXT C850 Core,850,159.99,80+ Gold,nzxt c series gold core atx 3 1 2025,A,Excellent noise profile.,108.1608695652174,https://m.media-amazon.com/images/I/4151uu3pCpL.jpg,Full,,ATX,Black,ATX 3.x
Rosewill VMG,1000,159.99,80+ Gold,rosewill vmg,B*,Assumed to be based on the same platform as the 750/850W variants. Need internal shots to confirm this before tiering.,129.1,//cdna.pcpartpicker.com/static/forever/images/product/5e96e1699bb3a55a6953448ee866fafa.256p.jpg,Full,,ATX,Black,ATX 3.x
Antec VP,450,159.99,,No Match,N/A,No Match Info,0,https://m.media-amazon.com/images/I/41v-OiujR4L.jpg,No,,ATX,,N/A
Asus ROG Strix Aura Edition,750,161.7,80+ Gold,asus rog strix aura gold,A-,OPP is set way higher than necessary and isn't reduced even under high operating temperatures. Very poor 200% excursion response.,127.95,//cdna.pcpartpicker.com/static/forever/images/product/7906b461b9927a788bd19f1ca19ca6e8.256p.jpg,Full,,ATX,Black,ATX 3.x
MSI MAG A750GLS PCIE5,750,161.99,80+ Gold,msi mag a gls pcie5,A-,Minor rails' OCP is set lower compared to the CWT-built high-wattage models. 650W is noisier than the 750W on account of using a DBB fan.,109.45,//cdna.pcpartpicker.com/static/forever/images/product/52d7cc5e286e952e3873f49ca19ae3f4.256p.jpg,Full,,ATX,Black,ATX 3.x
Sparkle FSP350-60GNV,350,163.53,,No Match,N/A,No Match Info,0,https://m.media-amazon.com/images/I/41HXnR5LtnL.jpg,No,,SFX,Silver,N/A
Corsair RM750x (2024),750,163.9,,No Match,N/A,No Match Info,0,//cdna.pcpartpicker.com/static/forever/images/product/e78e01bbb56c5608fe37fc45d2fcb2b5.256p.jpg,Full,,ATX,Black,N/A
be quiet! Pure Power 12,1000,163.99,80+ Gold,be quiet pure power 12,B*,"85C bulk caps, rifle bearing fan, non-modular.",118.6,//cdna.pcpartpicker.com/static/forever/images/product/158d0a5638c31a4f0783792c3737506a.256p.jpg,No,,ATX,Black,ATX 3.x
MSI MAG A850GL PCIE5,850,164.98,80+ Gold,msi mag a gl pcie5,B,"Solid electrical performance, let down by poorly tuned protections, mediocre transient response, and a low quality fan.",107.87368421052632,//cdna.pcpartpicker.com/static/forever/images/product/79be60ce3783b8918a1c0940d3e4ff19.256p.jpg,Full,,ATX,Black,ATX 3.x
Phanteks AMP GH,750,164.98,80+ Gold,phanteks amp gh gold,B,,128.75,//cdna.pcpartpicker.com/static/forever/images/product/f9c9719417368c3b38df8587d03cfa12.256p.jpg,Full,,ATX,Black,ATX 3.x
ASRock Steel Legend SL-650G,650,164.98,80+ Gold,asrock steel legend sl g,A,"1000W model has poor transient response on 12V under 200% spike, other models mediocre. 850/1000W avail. in white.",124.85217391304349,//cdna.pcpartpicker.com/static/forever/images/product/3b002e55ed7e54541868c5041da9daa9.256p.jpg,Full,,ATX,Black,ATX 3.x
Corsair RM850e (2025),850,164.99,,No Match,N/A,No Match Info,0,//cdna.pcpartpicker.com/static/forever/images/product/7d68ac724aae3cabe95f98de8df643ae.256p.jpg,Full,,ATX,White,N/A
NZXT C850 (2024),850,167.98,80+ Gold,nzxt c series gold atx 3 1 2024,A+,Available in black and white,110.68846153846154,//cdna.pcpartpicker.com/static/forever/images/product/c0060ae80a7b71686da1ca92324d0f68.256p.jpg,Full,,ATX,Black,ATX 3.x
ADATA XPG Core Reactor II VE,850,167.99,80+ Gold,adata xpg core reactor ii ve,A,Costdown Core Reactor II,129.4,//cdna.pcpartpicker.com/static/forever/images/product/9e9d7b460ca30ba78e9bba8a88fb4fe9.256p.jpg,Full,,ATX,,ATX 3.x
Gigabyte UD850GM,850,168.0,80+ Gold,gigabyte  ud gm,B+,"Updated version of the P-GM. Decent overall performance, but component quality leaves a bit to be desired (especially the fan.)",101.03333333333333,//cdna.pcpartpicker.com/static/forever/images/product/2fd893bbd3486b3f2878a98bb949e0bb.256p.jpg,Full,,ATX,Black,ATX 2.x
In Win P85,850,169.49,80+ Gold,inwin p gold,B-,OTP is claimed but has been hit-or-miss on NO-810 units and not present on the P125. Tier is based on other NO-810 units until tested.,75.6735294117647,https://m.media-amazon.com/images/I/41JKh6pOl2L.jpg,Full,,ATX,Black,ATX 2.x
Silverstone Extreme 500 Bronze,500,169.55,80+ Bronze,silverstone extreme sfx sfx l bronze,C-,,129.8,//cdna.pcpartpicker.com/static/forever/images/product/c6a047e41887e5fd4831a6c91d4e9184.256p.jpg,No,,SFX,Black / White,ATX 2.x
Thermaltake Smart BX1,750,169.79,80+ Bronze,thermaltake smart bx1 dc dc ver,C-*,,129.55,//cdna.pcpartpicker.com/static/forever/images/product/c5e3f4773b45f042fee966c501f6db17.256p.jpg,No,,ATX,Black,ATX 2.x
be quiet! Power Zone 2,850,169.9,80+ Platinum,be quiet power zone 2,B+,First be quiet! PSU with semi-passive operation.,119.55,//cdna.pcpartpicker.com/static/forever/images/product/a2d7bd1f1791322949e2087a850997dd.256p.jpg,Full,,ATX,Black,ATX 3.x
Thermaltake Toughpower GF1 (2024),750,169.98,80+ Gold,thermaltake toughpower gf1 premium 2024,B*,"Limited info; internal shots show it as a costdown GF A3 w/o 12VHPWR, Chinese caps and other cheap components; 140mm depth. Made in VN.",149.7,//cdna.pcpartpicker.com/static/forever/images/product/6ee215a762a575aaa7d2df86c919eb95.256p.jpg,Full,,ATX,Black,ATX 2.x
Phanteks AMP GH,750,169.98,80+ Gold,phanteks amp gh gold,B,,128.75,//cdna.pcpartpicker.com/static/forever/images/product/f25fd77acb728eb472d0546c627c4c54.256p.jpg,Full,,ATX,White,ATX 3.x
Lian Li EDGE GOLD,850,169.99,80+ Gold,lian li edge eg gold,A,German bulk caps; dual-chamber L-shape design; modular inputs on the main PCB. 1000W and up models come with a USB/fan hub.,128.75,//cdna.pcpartpicker.com/static/forever/images/product/f3d49f21c4bbc671af07e2be31f23b94.256p.jpg,Full,,ATX,White,ATX 3.x
Corsair RM750,750,169.99,80+ Gold,corsair rm 2021 black,B+,Triangular fan grille perforations. Hong Hua rifle bearing fan. Performance is assumed to be the same as 2019 version.,147.3,//cdna.pcpartpicker.com/static/forever/images/product/8912b48548fca5ee3606a5d93772928a.256p.jpg,Full,,ATX,White / Black,ATX 2.x
Lian Li EDGE,850,169.99,80+ Platinum,lian li edge platinum,A,German bulk caps; dual-chamber L-shape design; platform is an EPS-0100 modified to put the modular inputs on the main PCB.,129.05,https://m.media-amazon.com/images/I/51B4tZpOyDL.jpg,Full,,ATX,Black,ATX 3.x
Lian Li SP V2,750,169.99,80+ Gold,lian li sp v2,B*,,139.15,//cdna.pcpartpicker.com/static/forever/images/product/74a8106f89be795fead502bce4a8af17.256p.jpg,Full,,SFX,Black,ATX 3.x
Gigabyte UD-GM PG5,850,169.99,80+ Gold,gigabyte  ud gm pg5 v2,C+,"Various issues including low PF, poor excursion response, and terrible vampire power suppression. OCP is set sky-high on the minor rails.",129.05,//cdna.pcpartpicker.com/static/forever/images/product/71a63db2267f43304efa03516e480eb1.256p.jpg,Full,,ATX,White,ATX 3.x
SAMA P1200,1200,169.99,80+ Platinum,sama p,A,"The OCP and OPP triggering points need tuning. Very good ripple suppression, and decent component quality. Excellent noise profile.",108.8,//cdna.pcpartpicker.com/static/forever/images/product/eeab78550ed652d279719d6f0c349e6d.256p.jpg,Full,,ATX,Black,ATX 3.x
SAMA P1200,1200,169.99,80+ Platinum,sama p,A,"The OCP and OPP triggering points need tuning. Very good ripple suppression, and decent component quality. Excellent noise profile.",108.8,//cdna.pcpartpicker.com/static/forever/images/product/3fc38027dc58468a586bbd42488a7fdc.256p.jpg,Full,,ATX,White,ATX 3.x
Lian Li SP V2,750,169.99,80+ Gold,lian li sp v2,B*,,139.15,//cdna.pcpartpicker.com/static/forever/images/product/5cef027c8804cb46a44f2257da85ccca.256p.jpg,Full,,SFX,White,ATX 3.x
Rosewill CMG1000G5,1000,169.99,80+ Gold,rosewill cmg g5,A*,,113.09848484848484,https://m.media-amazon.com/images/I/41nIHCPN5hL.jpg,Full,,ATX,Black,ATX 3.x
Corsair TX550M Gold,550,170.22,80+ Gold,corsair tx m 2021 black label,A,Gray label,94.36666666666666,https://images-na.ssl-images-amazon.com/images/I/41z3I3BNcfL.jpg,Semi,,ATX,,ATX 2.x
FSP Group HEXA 85+ PRO,650,173.23,80+ Bronze,fsp fortron sparkle hexa 85 pro,C*,85+ refresh? No internal shots or performance data available as of now.,100.38333333333333,https://m.media-amazon.com/images/I/411tR4t-STL.jpg,No,,ATX,Black,ATX 2.x
Cooler Master MWE White V2 230V,700,173.43,80+,cooler master mwe v2 white,B,,137.8,//cdna.pcpartpicker.com/static/forever/images/product/25b04bd15445e49122eab536acaee519.256p.jpg,No,,ATX,Black,ATX 2.x
be quiet! SFX Power 3 450,450,173.72,80+ Bronze,be quiet sfx power 3,C*,No information.,117.5,//cdna.pcpartpicker.com/static/forever/images/product/6f22b32ac4c2844cc76bbee6ef798d01.256p.jpg,No,,SFX,Black,ATX 2.x
Asus TUF Gaming 850G,850,174.98,80+ Gold,asus tuf gold,B,12VHPWR to dual PCIE cable as well as a native 12VHPWR cable.,127.9,//cdna.pcpartpicker.com/static/forever/images/product/4f699d87a43e3c59ea964a1bf230301c.256p.jpg,Full,,ATX,Black,ATX 3.x
MSI A1000G PCIE5,1000,174.99,80+ Gold,msi mag a gl pcie5 ii,B+*,Sticker on unit is slightly different w/ yellow corner accents. All dimensions and specs are otherwise the same.,91.55,//cdna.pcpartpicker.com/static/forever/images/product/f4ba2af40fa30a597244521a441515b5.256p.jpg,Full,,ATX,Black,ATX 3.x
Thermaltake Toughpower GF1 (2024),850,176.98,80+ Gold,thermaltake toughpower gf1 premium 2024,B*,"Limited info; internal shots show it as a costdown GF A3 w/o 12VHPWR, Chinese caps and other cheap components; 140mm depth. Made in VN.",149.7,//cdna.pcpartpicker.com/static/forever/images/product/1d3c099db66ec0e9f5a65298b5aa5b96.256p.jpg,Full,,ATX,Black,ATX 2.x
Silverstone Essential,750,179.36,80+ Gold,silverstone strider essential st ef,E,,129.25,https://images-fe.ssl-images-amazon.com/images/I/511PE5hHeKL.jpg,No,,ATX,Black / Yellow,ATX 2.x
Corsair RM750e (2022),750,179.85,80+ Gold,corsair rm e 2022,B+,"750/850W: 140mm, 1000/1200W: 150mm. 2023 version includes 12VHPWR cable. Early reports of coil whine and premature failures/DOAs, but supposedly fixed.",124.52307692307691,//cdna.pcpartpicker.com/static/forever/images/product/f395e0fdaf74d2e7700fc3834f5ecf98.256p.jpg,Full,,ATX,Black,ATX 2.x
MSI MAG A850GL PCIE5,850,179.98,80+ Gold,msi mag a gl pcie5,B,"Solid electrical performance, let down by poorly tuned protections, mediocre transient response, and a low quality fan.",107.87368421052632,//cdna.pcpartpicker.com/static/forever/images/product/eef1b2e0ab31f6cbcbe01d162f44b952.256p.jpg,Full,,ATX,White,ATX 3.x
Montech CENTURY II,1200,179.99,80+ Gold,montech century ii gold atx 3 1,A,"Good performance and noise profile. High inrush current. OPP and OCP on the minor rails need tuning. Functional, but set high.",129.9,//cdna.pcpartpicker.com/static/forever/images/product/f973a0374020c80c5fb0199771036a12.256p.jpg,Full,,ATX,Black,ATX 3.x
Corsair RM750x SHIFT,750,179.99,80+ Gold,corsair rm x shift 2025,A+,Semi-digital. Very good noise profile and electrical performance. 5VSB OCP is set quite high.,48.87368421052632,//cdna.pcpartpicker.com/static/forever/images/product/7882f867747759b989aa762208c899ed.256p.jpg,Full / Side,,ATX,Black,ATX 3.x
Thermaltake Toughpower GF A3 Snow,850,179.99,80+ Gold,thermaltake toughpower gf a3 swap fagu l,B-,"Unnanounced OEM swap. Technically invalid 80 Plus certification, but did qualify for Gold in testing, as advertised.",131.80327868852459,//cdna.pcpartpicker.com/static/forever/images/product/f9f65f8de59f21fde47414034b68536c.256p.jpg,Full,,ATX,White,ATX 3.x
Antec NE1000G M White ATX 3.0,1000,179.99,80+ Gold,antec atom neo eco ne gold ne g modular atx 3 0,A,,81.6047619047619,//cdna.pcpartpicker.com/static/forever/images/product/b6d27806261945cf56ad666dd4e451de.256p.jpg,Full,,ATX,White,ATX 3.x
ADATA XPG KYBER,750,180.4,80+ Gold,adata xpg kyber,B-,,128.25,//cdna.pcpartpicker.com/static/forever/images/product/bda3fc099d5ee134c08ecccb4ba841d2.256p.jpg,No,,ATX,Black,ATX 3.x
ASRock Steel Legend SL-850GW,850,180.63,80+ Gold,asrock steel legend sl g,A,"1000W model has poor transient response on 12V under 200% spike, other models mediocre. 850/1000W avail. in white.",124.85217391304349,//cdna.pcpartpicker.com/static/forever/images/product/f0d0913927dbad7a2da55bd5a2100f43.256p.jpg,Full,,ATX,White,ATX 3.x
EVGA 700 BR,700,180.8,80+ Bronze,evga b series br,C-,"No OCP on 12V. High RMA rate due to MLCC cracks, similar to other HEC-built EVGA PSUs",127.8,//cdna.pcpartpicker.com/static/forever/images/product/cb871f8cf187922a16a18e53f17366ff.256p.jpg,No,,ATX,,ATX 2.x
Super Flower Leadex III Gold UP,750,181.98,80+ Gold,super flower leadex gold,A-,"Chinese caps, 20AWG gauges on the EPS/PCIe cables; 5VSB regulation doesn't quite hit A tier specifications.",123.45,//cdna.pcpartpicker.com/static/forever/images/product/72e79c9c6bb8b0b3bf0eba2806d3142b.256p.jpg,Full,,ATX,Black,ATX 2.x
Silverstone SFX,500,182.5,80+ Gold,silverstone extreme sfx sfx l rz gold,B*,"12V-2x6 connector on modular panel, but no included cable for it. Can be bought separately. Potentially to only need 150% excursions?",119.6,//cdna.pcpartpicker.com/static/forever/images/product/25aa74d682bfbb478cc7089f30086e4b.256p.jpg,Full,,SFX,Black,ATX 3.x
Corsair RM750x SHIFT,750,182.58,80+ Gold,corsair rm x shift 2025,A+,Semi-digital. Very good noise profile and electrical performance. 5VSB OCP is set quite high.,48.87368421052632,//cdna.pcpartpicker.com/static/forever/images/product/538f621aadcabc4d3a2a09a02d4df153.256p.jpg,Full / Side,,ATX,White,ATX 3.x
Lian Li EDGE GOLD,1000,182.92,80+ Gold,lian li edge eg gold,A,German bulk caps; dual-chamber L-shape design; modular inputs on the main PCB. 1000W and up models come with a USB/fan hub.,128.75,//cdna.pcpartpicker.com/static/forever/images/product/849f751a4ea67f2ed2cfd4ab47fb23eb.256p.jpg,Full,,ATX,Black,ATX 3.x
ASRock Steel Legend SL-1000GW,1000,183.42,80+ Gold,asrock steel legend sl g,A,"1000W model has poor transient response on 12V under 200% spike, other models mediocre. 850/1000W avail. in white.",124.85217391304349,//cdna.pcpartpicker.com/static/forever/images/product/6d1d63aca3da04d6875b5c13ca7212fc.256p.jpg,Full,,ATX,White,ATX 3.x
Enermax REVOLUTION III,650,184.85,80+ Gold,enermax revolution iii,A*,"Internal shots are promising, but further testing is needed before tiering.",129.6,https://m.media-amazon.com/images/I/31DCRekNQfL.jpg,Full,,ATX,Black / Gold,ATX 3.x
Thermaltake Toughpower GF A3 - TT Premium Edition,750,185.99,80+ Gold,thermaltake toughpower gf a3 swap fagu l,B-,"Unnanounced OEM swap. Technically invalid 80 Plus certification, but did qualify for Gold in testing, as advertised.",122.35294117647058,//cdna.pcpartpicker.com/static/forever/images/product/ad75696f5880e84710e8c64cdaada823.256p.jpg,Full,,ATX,Black,ATX 3.x
ASRock Phantom Gaming PG-850G,850,187.61,80+ Gold,asrock phantom gaming pg g,A,"12V-2x6 connector (GPU side) has thermistors to act as an ""OTP"" against melting. Stellar ripple suppression, especially on the minor rails.",125.3,//cdna.pcpartpicker.com/static/forever/images/product/570c93c20fb5424ff85c5da1f825863f.256p.jpg,Full,,ATX,Black,ATX 3.x
