SeaSonic Focus GX V4 ATX 3 (2024),750,187.98,80+ Gold,seasonic focus gx v4 atx 3 1,A-,"Black model has white line accents, compared to V3. Stupidly high inrush current, mediocre transient response, minor rails' OCP need tuning.",149.4,//cdna.pcpartpicker.com/static/forever/images/product/95e33387277fc0fc6e46c69add179ba1.256p.jpg,Full,,ATX,White,ATX 3.x
MSI MAG A850GLS PCIE5,850,188.99,80+ Gold,msi mag a gls pcie5,A-,Extremely quiet operation; however OCP is set high on the minor rails.,109.45,//cdna.pcpartpicker.com/static/forever/images/product/fa347a07533a6c595dababca139e5a62.256p.jpg,Full,,ATX,Black,ATX 3.x
Antec NE1000G M ATX3.0,1000,189.0,80+ Gold,No Match,N/A,No Match Info,0,//cdna.pcpartpicker.com/static/forever/images/product/cbd3c5accd08fbe9dee03a7ed0000697.256p.jpg,Full,,ATX,Black,N/A
Thermaltake Smart BM2,750,189.57,80+ Bronze,thermaltake smart bm2 ver b 2024,C-*,12V capacity is rated much lower than the CWT CSB-A models.,129.35,https://m.media-amazon.com/images/I/412Om9NpBbL.jpg,Semi,,ATX,Black,ATX 2.x
Corsair RM750 (2019),750,189.68,80+ Gold,corsair rm 2019 gray label,B+,Grey label; costdown RM-x. Out-of-spec 3.3V transients. Hong Hua rifle bearing fan. Meets all other tier A requirements.,116.55,//cdna.pcpartpicker.com/static/forever/images/product/02951377c9eed1e21fc3d8ba6092717e.256p.jpg,Full,,ATX,Black,ATX 2.x
Phanteks AMP GH,850,189.98,80+ Gold,phanteks amp gh gold,B,,128.75,//cdna.pcpartpicker.com/static/forever/images/product/f9c9719417368c3b38df8587d03cfa12.256p.jpg,Full,,ATX,Black,ATX 3.x
Phanteks AMP GH,850,189.98,80+ Gold,phanteks amp gh gold,B,,128.75,//cdna.pcpartpicker.com/static/forever/images/product/f25fd77acb728eb472d0546c627c4c54.256p.jpg,Full,,ATX,White,ATX 3.x
Super Flower Zillion FG,1050,189.98,80+ Gold,super flower zillion fg gold atx 3 1,B-*,,129.65,//cdna.pcpartpicker.com/static/forever/images/product/7ca08574210884ec7e77eb2fbd3dc92f.256p.jpg,Full,,ATX,Black,ATX 3.x
be quiet! Pure Power 12 M,1000,189.99,80+ Gold,be quiet pure power 12 m,A,Not to be confused with the non-modular Pure Power 12!,118.7,//cdna.pcpartpicker.com/static/forever/images/product/02078adf4372cab46e72fc7dc8ff4553.256p.jpg,Full,,ATX,Black,ATX 3.x
NZXT C850 (2024),850,189.99,80+ Gold,nzxt c series gold atx 3 1 2024,A+,Available in black and white,110.68846153846154,//cdna.pcpartpicker.com/static/forever/images/product/364e60bcdf53b659caa2e3d41bad0f80.256p.jpg,Full,,ATX,White,ATX 3.x
NZXT C1000 Core,1000,189.99,80+ Gold,nzxt c series gold core atx 3 1 2025,A,Excellent noise profile.,104.9,https://m.media-amazon.com/images/I/41DQWFmQQQL.jpg,Full,,ATX,Black,ATX 3.x
Rosewill CMG1200G5,1200,189.99,80+ Gold,rosewill cmg g5,A*,,113.09848484848484,https://m.media-amazon.com/images/I/41K78PBR3wL.jpg,Full,,ATX,Black,ATX 3.x
Chieftec Vita,850,194.1,80+ Bronze,chieftec chieftronic vita bpx s,C-,"3 year warranty; 85C bulk cap, and not one of particularly good quality, either.",119.55,//cdna.pcpartpicker.com/static/forever/images/product/a55b2cba4a51c1301e4fc05b02970d58.256p.jpg,No,,ATX,Black / Blue,ATX 2.x
Corsair RM1000e (2025),1000,194.95,,No Match,N/A,No Match Info,0,//cdna.pcpartpicker.com/static/forever/images/product/e1a0bb0ca24bc0c2d95fea57a8c2019d.256p.jpg,Full,,ATX,Black,N/A
Asus TUF Gaming 1000G,1000,194.98,80+ Gold,asus tuf gold,B,12VHPWR to dual PCIE cable as well as a native 12VHPWR cable.,127.9,//cdna.pcpartpicker.com/static/forever/images/product/06eac4dd425e5a1d1e70735068c47072.256p.jpg,Full,,ATX,Black,ATX 3.x
Corsair RM1000x SHIFT,1000,196.98,80+ Gold,corsair rm x shift 2025,A+,Semi-digital. Very good noise profile and electrical performance. 5VSB OCP is set quite high.,46.57948717948719,//cdna.pcpartpicker.com/static/forever/images/product/38942a1637e7445c59b8a274492115a5.256p.jpg,Full / Side,,ATX,Black,ATX 3.x
Lian Li EDGE GOLD,1000,197.98,80+ Gold,lian li edge eg gold,A,German bulk caps; dual-chamber L-shape design; modular inputs on the main PCB. 1000W and up models come with a USB/fan hub.,128.75,//cdna.pcpartpicker.com/static/forever/images/product/6cd392c0ddcb76b70bdf0b6ed14e34ca.256p.jpg,Full,,ATX,White,ATX 3.x
Corsair RM750,750,199.41,80+ Gold,corsair rm 2021 black,B+,Triangular fan grille perforations. Hong Hua rifle bearing fan. Performance is assumed to be the same as 2019 version.,147.3,//cdna.pcpartpicker.com/static/forever/images/product/ba1237e2349bec09bccff4016facca23.256p.jpg,Full,,ATX,Black,ATX 2.x
Corsair RM850e (2022),850,199.88,80+ Gold,corsair rm e 2022,B+,"750/850W: 140mm, 1000/1200W: 150mm. 2023 version includes 12VHPWR cable. Early reports of coil whine and premature failures/DOAs, but supposedly fixed.",124.52307692307691,//cdna.pcpartpicker.com/static/forever/images/product/237b36018991e28d227eaa0158bd0425.256p.jpg,Full,,ATX,Black,ATX 2.x
be quiet! Power Zone 2,1000,199.9,80+ Platinum,be quiet power zone 2,B+,First be quiet! PSU with semi-passive operation.,119.55,//cdna.pcpartpicker.com/static/forever/images/product/838e53fd8b582b17bbac83fab611f118.256p.jpg,Full,,ATX,Black,ATX 3.x
Corsair RM750x (2021),750,199.96,80+ Gold,corsair rm x 2021,A+,"160mm length, Sunon Magnetic Levitation (Maglev) bearing fan.",131.7153846153846,//cdna.pcpartpicker.com/static/forever/images/product/1b188238912bad1b60bbfef7d8912470.256p.jpg,Full,,ATX,Black,ATX 2.x
Super Flower LEADEX VII XG,1000,199.99,80+ Gold,super flower leadex vii gold xg,A+,White variant available at 1kW.,128.9,//cdna.pcpartpicker.com/static/forever/images/product/9a2a26333f0bbcb4d60377c747686cb4.256p.jpg,Full,,ATX,Black,ATX 3.x
Super Flower LEADEX VII XG,1000,199.99,80+ Gold,super flower leadex vii gold xg,A+,White variant available at 1kW.,128.9,//cdna.pcpartpicker.com/static/forever/images/product/1e617d05abd44c115115a1bb69de33b8.256p.jpg,Full,,ATX,White,ATX 3.x
MSI MPG A850GS PCIE5,850,200.99,80+ Gold,msi mpg a gs pcie5,A,Semi-digital.,108.87368421052632,//cdna.pcpartpicker.com/static/forever/images/product/e30f8fbb357a16391b3a15586b9aaec4.256p.jpg,Full,,ATX,Black,ATX 3.x
MSI MAG A1000GL PCIE5,1000,201.99,80+ Gold,msi mag a gl pcie5,B+,5V OCP malfunctioned under high temps; CSZ costdown with Chinese caps and inexpensive bridge rectifiers per Aris' testing .,105.57948717948719,//cdna.pcpartpicker.com/static/forever/images/product/d341970c610a68f6188dd0c370743769.256p.jpg,Full,,ATX,Black,ATX 3.x
ASRock Steel Legend SL-1200G,1200,201.99,80+ Gold,asrock steel legend sl g,A,OCP is set way higher than necessary on the 12V and 5VSB rails. Good noise profile given its capacity.,125.35217391304349,//cdna.pcpartpicker.com/static/forever/images/product/86500b70d0de9d566e286895462c9b24.256p.jpg,Full,,ATX,Black,ATX 3.x
Xilence XP600R6,600,203.47,,No Match,N/A,No Match Info,0,//cdna.pcpartpicker.com/static/forever/images/product/5b1ec52685b70f9f36d952da40e897e5.256p.jpg,No,,ATX,Black / Red,N/A
RAIJINTEK AMPERE,1000,204.0,80+ Platinum,raijintek ampere,B*,Just a guess. No internal shots.,128.8,https://m.media-amazon.com/images/I/41998+pxBSL.jpg,Full,,ATX,Black,ATX 3.x
Chieftec Vega M,750,204.49,80+ Gold,chieftec chieftronic vega modular m ppg c,A,,110.05,https://m.media-amazon.com/images/I/51IyeYKFFrL.jpg,Full,,ATX,Black / Blue,ATX 3.x
be quiet! Pure Power 13 M,1000,207.91,80+ Gold,be quiet pure power 13 m,A,Excursion response in the 200% test could be better compared to other units in its class. Excellent noise profile.,119.7,https://m.media-amazon.com/images/I/51NcpqwxV1L.jpg,Full,,ATX,Black,ATX 3.x
Lian Li EDGE GOLD,1200,208.32,80+ Gold,lian li edge eg gold,A,German bulk caps; dual-chamber L-shape design; modular inputs on the main PCB. 1000W and up models come with a USB/fan hub.,128.75,//cdna.pcpartpicker.com/static/forever/images/product/b584f337a037ee95efe26b3c208c5144.256p.jpg,Full,,ATX,Black,ATX 3.x
Enermax REVOLUTION III,750,209.35,80+ Gold,enermax revolution iii,A*,"Internal shots are promising, but further testing is needed before tiering.",129.6,https://m.media-amazon.com/images/I/31bClvcBPSL.jpg,Full,,ATX,Black / Gold,ATX 3.x
Silverstone Essential,750,209.58,80+ Gold,silverstone essential gold et hg,B,,126.45,https://m.media-amazon.com/images/I/511OoR096DL.jpg,Semi,,ATX,Black / Blue,ATX 2.x
Corsair RM1000x (2024),1000,209.98,,No Match,N/A,No Match Info,0,//cdna.pcpartpicker.com/static/forever/images/product/8bc2cb01b2a5875aa983b4cc5be68221.256p.jpg,Full,,ATX,Black,N/A
Corsair RM1000e (2025),1000,209.99,,No Match,N/A,No Match Info,0,//cdna.pcpartpicker.com/static/forever/images/product/9fc6cb597b8f13a08550ae7d3eba25bf.256p.jpg,Full,,ATX,White,N/A
Asus ROG Strix,750,209.99,80+ Gold,asus rog strix aura gold,A-,OPP is set way higher than necessary and isn't reduced even under high operating temperatures. Very poor 200% excursion response.,127.95,//cdna.pcpartpicker.com/static/forever/images/product/ba70a2eb144a1dafb714c0f37eaabc30.256p.jpg,Full,,ATX,Black / Red,ATX 3.x
Corsair RMx SHIFT (2025),850,209.99,,No Match,N/A,No Match Info,0,//cdna.pcpartpicker.com/static/forever/images/product/957db30c1ec9ac67ed17900385729064.256p.jpg,Full / Side,,ATX,Black,N/A
Chieftec Polaris,650,210.47,80+ Gold,chieftec chieftronic polaris pps fc,B-,"Both EPS connectors share a cable, poor regulation and transient response on minor rails; only a 2 year warranty.",117.25,https://m.media-amazon.com/images/I/41VMHjYnjKL.jpg,Full,,ATX,Black,ATX 2.x
Corsair CX650F,650,211.03,80+ Bronze,corsair cx f rgb,B,Technically 80+ Silver without RGB on,100.13333333333333,//cdna.pcpartpicker.com/static/forever/images/product/015d98417e035b82cc9dbe2053dc7919.256p.jpg,Full,,ATX,White / Black,ATX 2.x
Corsair RM850 (2019),850,211.57,80+ Gold,corsair rm 2019 gray label,B+,Grey label; costdown RM-x. Out-of-spec 3.3V transients. Hong Hua rifle bearing fan. Meets all other tier A requirements.,116.55,//cdna.pcpartpicker.com/static/forever/images/product/3890f047bb5f8abb3f887ee40d27867e.256p.jpg,Full,,ATX,Black,ATX 2.x
Gigabyte UD1000GM,1000,211.85,80+ Gold,gigabyte p gm,C*,"Allegedly not affected by the bad FET design, however, no proper testing exists to confirm this.",103.3404761904762,//cdna.pcpartpicker.com/static/forever/images/product/36a1106bfef38acdd03cdaf5ba5c8a08.256p.jpg,Full,,ATX,Black,ATX 2.x
Thermaltake Toughpower iRGB PLUS 750,750,214.24,80+ Gold,thermaltake toughpower irgb plus gold,A-,OTP claimed; tested working in other GPR-based units in similar configurations.,127.1,//cdna.pcpartpicker.com/static/forever/images/product/36c3f2162cb7c105b5aceb9d291a4ccc.256p.jpg,Full,,ATX,Black,ATX 2.x
Lian Li SP0850P,850,214.99,80+ Platinum,lian li sp p,B*,,103.17407407407407,//cdna.pcpartpicker.com/static/forever/images/product/7ae9912c397b04dd9a143466c35d20cd.256p.jpg,Full,,SFX,Black,ATX 3.x
MSI MAG A1000GLS PCIE5,1000,214.99,80+ Gold,msi mag a gls pcie5,A-,Extremely quiet operation; however OCP is set high on the minor rails.,107.2548780487805,//cdna.pcpartpicker.com/static/forever/images/product/009f529c253efdcffa7588b07a793742.256p.jpg,Full,,ATX,Black,ATX 3.x
Lian Li SP0850P,850,214.99,80+ Platinum,lian li sp p,B*,,103.17407407407407,//cdna.pcpartpicker.com/static/forever/images/product/787aa6bbebdd60990571826c80f77416.256p.jpg,Full,,SFX,White,ATX 3.x
Thermaltake Toughpower GF2 ARGB,650,218.98,80+ Gold,thermaltake toughpower gf2 argb,A-,,128.05,https://m.media-amazon.com/images/I/51e9DyngGIL.jpg,Full,,ATX,Black,ATX 2.x
Corsair RM1000e (2022),1000,219.19,80+ Gold,corsair rm e 2022,B+,"750/850W: 140mm, 1000/1200W: 150mm. 2023 version includes 12VHPWR cable. Early reports of coil whine and premature failures/DOAs, but supposedly fixed.",121.67407407407407,//cdna.pcpartpicker.com/static/forever/images/product/46c4b5b61ad3f8ed2688995b85520a68.256p.jpg,Full,,ATX,Black,ATX 2.x
Thermaltake Toughpower GF A3 Snow,1050,219.45,80+ Gold,thermaltake toughpower gf a3 swap fagu l,B*,Unnanounced OEM swap. Technically invalid 80 Plus certification.,131.80327868852459,//cdna.pcpartpicker.com/static/forever/images/product/f8517a9b576c3320af532ce509a9efc3.256p.jpg,Full,,ATX,White,ATX 3.x
Lian Li EDGE,1000,219.99,80+ Platinum,lian li edge platinum,A,German bulk caps; dual-chamber L-shape design; platform is an EPS-0100 modified to put the modular inputs on the main PCB.,129.05,//cdna.pcpartpicker.com/static/forever/images/product/2b6505f267e91c686ae87e596ed59260.256p.jpg,Full,,ATX,Black,ATX 3.x
Cooler Master V850 SFX GOLD,850,219.99,80+ Gold,cooler master v series vanguard gold sfx atx 3 1,A,Still essentially G1278 with further updates to ATX 3.1,117.42948717948718,//cdna.pcpartpicker.com/static/forever/images/product/bd2577c6ecabce9f78526a09410351e0.256p.jpg,Full,,SFX,Black,ATX 3.x
Corsair RM850x SHIFT,850,219.99,80+ Gold,corsair rm x shift 2025,A+,Semi-digital. Very good noise profile and electrical performance. 5VSB OCP is set quite high.,48.87368421052632,//cdna.pcpartpicker.com/static/forever/images/product/7882f867747759b989aa762208c899ed.256p.jpg,Full / Side,,ATX,Black,ATX 3.x
NZXT C1000 (2024),1000,219.99,80+ Gold,nzxt c series gold atx 3 1 2024,A+,Available in black and white,106.29285714285714,//cdna.pcpartpicker.com/static/forever/images/product/b4b18aa0b5be85db9ae15621bee38be7.256p.jpg,Full,,ATX,Black,ATX 3.x
Super Flower Leadex III Gold UP,1000,219.99,80+ Gold,super flower leadex gold,A-,1300W 5VSB voltage regulation doesn't quite hit A tier performance.,123.45,//cdna.pcpartpicker.com/static/forever/images/product/8518dc8b066169771e77870f3a73d3ed.256p.jpg,Full,,ATX,Black,ATX 2.x
Corsair RM850,850,219.99,80+ Gold,corsair rm 2021 black,B+,Triangular fan grille perforations. Hong Hua rifle bearing fan. Performance is assumed to be the same as 2019 version.,147.3,//cdna.pcpartpicker.com/static/forever/images/product/66dbe902337399e341f967959693cdb8.256p.jpg,Full,,ATX,Black,ATX 2.x
Cooler Master V850 SFX GOLD,850,219.99,80+ Gold,cooler master v series vanguard gold sfx atx 3 1,A,Still essentially G1278 with further updates to ATX 3.1,117.42948717948718,//cdna.pcpartpicker.com/static/forever/images/product/06ebd1caff0c0f63980f87e800a58812.256p.jpg,Full,,SFX,White,ATX 3.x
NZXT C1000 (2024),1000,219.99,80+ Gold,nzxt c series gold atx 3 1 2024,A+,Available in black and white,106.29285714285714,//cdna.pcpartpicker.com/static/forever/images/product/a1414d14d663ac501c33db5a05fa5560.256p.jpg,Full,,ATX,White,ATX 3.x
Super Flower LEADEX VII Platinum PRO,1000,219.99,80+ Platinum,super flower leadex vii platinum pro xp,A+,,129.45,//cdna.pcpartpicker.com/static/forever/images/product/8c2829b9a24bc87b620fa4be377b8d69.256p.jpg,Full,,ATX,Black,ATX 3.x
Gigabyte UD1000GM PG5 (rev. 2.0),1000,219.99,80+ Gold,gigabyte p gm,C*,"Allegedly not affected by the bad FET design, however, no proper testing exists to confirm this.",103.3404761904762,//cdna.pcpartpicker.com/static/forever/images/product/57c3b482e6f4ab64bb5406715273ca8a.256p.jpg,Full,,ATX,Black,ATX 2.x
Chieftec Vega,850,222.4,80+ Gold,chieftec chieftronic vega non modular ppg s,A,"Good build and component quality, with good ripple suppression and a decent noise profile. Notably, Aris received a PPG-C sample with a higher capacitance bulk capacitor, different from what other reviews had. PPG-C and PPG-S are identical aside from modularity.",110.15,https://m.media-amazon.com/images/I/31nq38N2ZpL.jpg,No,,ATX,Black / Blue,ATX 3.x
Lian Li SP850,850,222.84,80+ Gold,lian li sp,F,Fatal design flaw that causes an X cap to melt under 100VAC; potential fire hazard. Two samples also died during LTT Labs testing.,114.45652173913044,//cdna.pcpartpicker.com/static/forever/images/product/1c096a9315345f920e4988fc4eda404e.256p.jpg,Full,,SFX,White,ATX 2.x
Thermaltake TR2 S,700,224.45,80+,thermaltake tr2 s dc dc ver,C-*,"Flat black cables, model PS-TRS-[Wattage]NNSAW. Claims DC-DC and all protections. Possibly double-sourced with HKC.",128.85,https://m.media-amazon.com/images/I/51uuHGYKMML.jpg,No,,ATX,Black,ATX 2.x
Super Flower LEADEX VII XG,850,224.98,80+ Gold,super flower leadex vii gold xg,A+,White variant available at 1kW.,128.9,//cdna.pcpartpicker.com/static/forever/images/product/de671aec9c805b57174bedba1d6ede0a.256p.jpg,Full,,ATX,White,ATX 3.x
Thermaltake Smart BM3,650,225.61,80+ Bronze,thermaltake smart bm3,C,"Transient response was tested but values were left out. OPP is set very high, but the PSU handled it and shut down safely and properly.",128.55,//cdna.pcpartpicker.com/static/forever/images/product/4f3b7e2fa6212bc5d7addadf36fa2b1b.256p.jpg,Semi,,ATX,Black,ATX 3.x
Lian Li EDGE GOLD,1200,226.64,80+ Gold,lian li edge eg gold,A,German bulk caps; dual-chamber L-shape design; modular inputs on the main PCB. 1000W and up models come with a USB/fan hub.,128.75,//cdna.pcpartpicker.com/static/forever/images/product/56bd324b5bd00d1f686df673c4fb529e.256p.jpg,Full,,ATX,White,ATX 3.x
SeaSonic SS-600ES,600,227.7,80+ Bronze,seasonic a12,F,,107.1,//cdna.pcpartpicker.com/static/forever/images/product/6ec3f9d0b0d7ae18e60ae9ccd0985872.256p.jpg,No,,ATX,Gray,ATX 2.x
Silverstone ST75F-GS-V3,750,227.97,80+ Gold,silverstone strider gold stf gs v3,B*,,110.05,https://m.media-amazon.com/images/I/51hx-kcJoAL.jpg,Full,,ATX,Black,ATX 2.x
Cougar GEX,1050,228.85,80+ Gold,cougar gex,B,,127.0,//cdna.pcpartpicker.com/static/forever/images/product/3e8e03a49bcfcec9358f0e80e3aa97cc.256p.jpg,Full,,ATX,Black,ATX 2.x
Antec NE1300G M ATX3.0,1300,228.91,80+ Gold,No Match,N/A,No Match Info,0,//cdna.pcpartpicker.com/static/forever/images/product/5db1fde23f24b0aa753317aeef0b2cd4.256p.jpg,Full,,ATX,Black,N/A
Asus ROG Strix,1000,228.99,80+ Platinum,asus rog strix platinum,A,Much better performance than the 1200W model and fewer issues despite using the same platform. 5VSB OCP set high.,129.15,//cdna.pcpartpicker.com/static/forever/images/product/68d59d4cd47252cb8074986bac2f0cb8.256p.jpg,Full,,ATX,Black,ATX 3.x
ASRock Phantom Gaming PG-1000G,1000,229.53,80+ Gold,asrock phantom gaming pg g,A,"12V-2x6 connector (GPU side) has thermistors to act as an ""OTP"" against melting. Stellar ripple suppression, especially on the minor rails.",125.3,//cdna.pcpartpicker.com/static/forever/images/product/e1ea936c39d4f53dcabaa388ba82ff07.256p.jpg,Full,,ATX,Black,ATX 3.x
ASRock Steel Legend SL-1200GW,1200,229.53,80+ Gold,asrock steel legend sl g,A,OCP is set way higher than necessary on the 12V and 5VSB rails. Good noise profile given its capacity.,125.35217391304349,//cdna.pcpartpicker.com/static/forever/images/product/b05aa73cae30b3785615c2388e333175.256p.jpg,Full,,ATX,White,ATX 3.x
Super Flower Leadex III Gold UP,1300,229.98,80+ Gold,super flower leadex gold,A-,1300W 5VSB voltage regulation doesn't quite hit A tier performance.,123.45,//cdna.pcpartpicker.com/static/forever/images/product/8518dc8b066169771e77870f3a73d3ed.256p.jpg,Full,,ATX,Black,ATX 2.x
Corsair RM850e (2023),850,229.99,80+ Gold,corsair rm e 2023 gen 5,B+,,115.06666666666666,//cdna.pcpartpicker.com/static/forever/images/product/74e6caafd69bcc53d6e5060a3249248d.256p.jpg,Full,,ATX,Black,ATX 3.x
MSI A850GLS MLG EDITION,850,229.99,80+ Gold,msi mag a gl pcie5 ii,B*,Sticker on unit is slightly different w/ yellow corner accents. All dimensions and specs are otherwise the same.,78.64090909090909,https://m.media-amazon.com/images/I/51QqVqyXLaL.jpg,Full,,ATX,Red / Black,ATX 3.x
Rosewill CMG850G5,850,232.34,80+ Gold,rosewill cmg,B*,,110.35862068965517,https://m.media-amazon.com/images/I/41kpwyrL88L.jpg,Full,,ATX,Black,ATX 2.x
Asus ROG-STRIX-850G,850,232.5,80+ Gold,asus rog strix gold,A,650W has poor 3.3V transient response,126.7,//cdna.pcpartpicker.com/static/forever/images/product/ed389950ed8edcbe841a379aea923139.256p.jpg,Full,,ATX,Black,ATX 2.x
Silverstone Strider Platinum,750,235.04,80+ Platinum,silverstone strider platinum st f pt,B+,Good electrical performance let down by no inrush protection; bad power good signal.,125.8,https://m.media-amazon.com/images/I/51WamsChH-L.jpg,Full,,ATX,,ATX 2.x
Silverstone DA750 Gold,750,235.08,80+ Gold,silverstone triton rz gold,B-,"Claims an ICB fan, actually uses an LLS (rifle) bearing. Noisy ~40dBA for 750W and in excess of 48dBA for the 850W under full load.",108.12142857142857,//cdna.pcpartpicker.com/static/forever/images/product/86e43d07e104412be4e0e875349a9ec1.256p.jpg,Full,,ATX,Black / White,ATX 3.x
SeaSonic Focus GX V4 ATX 3 (2024),1000,235.4,80+ Gold,seasonic focus gx v4 atx 3 1,A-,"Black model has white line accents, compared to V3. Stupidly high inrush current, mediocre transient response, minor rails' OCP need tuning.",149.4,//cdna.pcpartpicker.com/static/forever/images/product/4bbfa7511d6ffe257ac933789dfdadf7.256p.jpg,Full,,ATX,Black,ATX 3.x
SeaSonic SSP-300SUG,300,237.14,80+ Gold,No Match,N/A,No Match Info,0,https://m.media-amazon.com/images/I/51YUOjSvMCL.jpg,No,,Flex ATX,Silver,N/A
SeaSonic Focus GX V4 ATX 3 (2024),850,237.98,80+ Gold,seasonic focus gx v4 atx 3 1,A-,"Black model has white line accents, compared to V3. Stupidly high inrush current, mediocre transient response, minor rails' OCP need tuning.",149.4,//cdna.pcpartpicker.com/static/forever/images/product/c47adb16cfeb519bade71008c258af92.256p.jpg,Full,,ATX,White,ATX 3.x
SeaSonic Focus GX V4 ATX 3 (2024),1000,238.7,80+ Gold,seasonic focus gx v4 atx 3 1,A-,"Black model has white line accents, compared to V3. Stupidly high inrush current, mediocre transient response, minor rails' OCP need tuning.",149.4,//cdna.pcpartpicker.com/static/forever/images/product/6b17b20795b473fa047bd22d6a451821.256p.jpg,Full,,ATX,White,ATX 3.x
Asus ROG Strix,850,239.98,80+ Gold,asus rog strix aura gold,A-,OPP is set way higher than necessary and isn't reduced even under high operating temperatures. Very poor 200% excursion response.,127.95,https://m.media-amazon.com/images/I/41E5-YifLvL.jpg,Full,,ATX,White,ATX 3.x
Corsair RM850x SHIFT,850,239.99,80+ Gold,corsair rm x shift 2025,A+,Semi-digital. Very good noise profile and electrical performance. 5VSB OCP is set quite high.,48.87368421052632,//cdna.pcpartpicker.com/static/forever/images/product/a6cedc8c48e1ab371cc0c2f4aba3f76d.256p.jpg,Full / Side,,ATX,White,ATX 3.x
Super Flower LEADEX VII XG,1300,239.99,80+ Gold,super flower leadex vii gold xg,A+,White variant available at 1kW.,128.9,//cdna.pcpartpicker.com/static/forever/images/product/9a2a26333f0bbcb4d60377c747686cb4.256p.jpg,Full,,ATX,Black,ATX 3.x
Asus ROG STRIX 1000P GAMING,1000,240.99,80+ Platinum,asus rog strix platinum,A,Much better performance than the 1200W model and fewer issues despite using the same platform. 5VSB OCP set high.,105.15,//cdna.pcpartpicker.com/static/forever/images/product/00740342f05d6f0c6cb281dae99939b7.256p.jpg,Full,,ATX,White,ATX 3.x
MSI MPG A850G PCIE5,850,241.5,80+ Gold,msi mpg a g pcie5,A,ATX 3.0 refresh,106.73888888888888,//cdna.pcpartpicker.com/static/forever/images/product/5bff625e69da1c7069c73f477b42ca41.256p.jpg,Full,,ATX,Black,ATX 3.x
Asus TUF Gaming 1000G,1000,243.99,80+ Gold,asus tuf gold,B,12VHPWR to dual PCIE cable as well as a native 12VHPWR cable.,127.9,//cdna.pcpartpicker.com/static/forever/images/product/6f6f30fe3667a292aee80208a58acb28.256p.jpg,Full,,ATX,White,ATX 3.x
Lian Li EDGE,1000,247.66,80+ Platinum,lian li edge platinum,A,German bulk caps; dual-chamber L-shape design; platform is an EPS-0100 modified to put the modular inputs on the main PCB.,129.05,//cdna.pcpartpicker.com/static/forever/images/product/0f7d3cf44d7b3628c00c65f3f476d52e.256p.jpg,Full,,ATX,White,ATX 3.x
Lian Li SP1000P,1000,247.96,80+ Platinum,lian li sp p,B*,,103.17407407407407,//cdna.pcpartpicker.com/static/forever/images/product/9aae2f1751c54bf1615dea0e733e47d8.256p.jpg,Full,,SFX,Black,ATX 3.x
be quiet! Dark Power 14,850,247.99,80+ Titanium,be quiet dark power 14,A,"Bridgeless PFC, very high component and build quality. OCP needs tuning on all rails. Excellent noise profile.",119.6,//cdna.pcpartpicker.com/static/forever/images/product/ea76ce713a5f8cc568a895e86a481197.256p.jpg,Full,,ATX,Black,ATX 3.x
Corsair SF750 (2024),750,248.18,80+ Platinum,corsair sf platinum 2024 atx 3 1,A+,"Class-leading performance, excellent build quality, relatively quiet for the capacity.",109.35,//cdna.pcpartpicker.com/static/forever/images/product/e297517330e5a91ec38e95b9377df1a0.256p.jpg,Full,,SFX,Black,ATX 3.x
Gigabyte UD1000GM PG5,1000,249.15,80+ Gold,gigabyte p gm,C*,"Allegedly not affected by the bad FET design, however, no proper testing exists to confirm this.",103.3404761904762,//cdna.pcpartpicker.com/static/forever/images/product/c84118960c20f8774ce1496513c2f98a.256p.jpg,Full,,ATX,Black,ATX 2.x
