be quiet! Pure Power 12 M,750,109.9,80+ Gold,be quiet pure power 12 m,A,Not to be confused with the non-modular Pure Power 12.,110.8,//cdna.pcpartpicker.com/static/forever/images/product/2ca5468038b7443022cee1bb7474a477.256p.jpg,Full,,ATX,Black
Montech CENTURY II,1050,109.9,80+ Gold,montech century ii gold atx 3 1,A,"Good performance and noise profile. High inrush current. OPP and OCP on the minor rails need tuning. Functional, but set high.",111.6,//cdna.pcpartpicker.com/static/forever/images/product/c04beca6c6820e5b4fe612ab1850b8cd.256p.jpg,Full,,ATX,Black
be quiet! Pure Power 13 M,750,109.9,80+ Gold,be quiet pure power 13 m,A,Excellent noise profile.,110.8,https://m.media-amazon.com/images/I/51NcpqwxV1L.jpg,Full,,ATX,Black
MSI MAG A750GL PCIE5,750,109.98,80+ Gold,msi mag a gl pcie5,B,"Solid electrical performance, let down by poorly tuned protections, mediocre transient response, and a low quality fan.",99.07368421052631,//cdna.pcpartpicker.com/static/forever/images/product/d8f4d13ba49891eb3929bdddc3d87b4b.256p.jpg,Full,,ATX,Black
Lian Li EDGE GOLD,850,109.99,80+ Gold,No Match,N/A,N/A,0,//cdna.pcpartpicker.com/static/forever/images/product/9a5971cefd086b73cf477e550aed363a.256p.jpg,Full,,ATX,Black
ASRock Phantom Gaming PG-850G,850,109.99,80+ Gold,asrock phantom gaming pg g,A,"12V-2x6 connector (GPU side) has thermistors to act as an ""OTP"" against melting. Stellar ripple suppression, especially on the minor rails.",107.2,//cdna.pcpartpicker.com/static/forever/images/product/570c93c20fb5424ff85c5da1f825863f.256p.jpg,Full,,ATX,Black
Thermaltake Toughpower GF A3 - TT Premium Edition,750,109.99,80+ Gold,thermaltake toughpower gf a3 n amer,B-,"Unnanounced OEM swap for North American market. Technically invalid 80 Plus certification, but did qualify for Gold in testing, as advertised.",121.88888888888889,//cdna.pcpartpicker.com/static/forever/images/product/ad75696f5880e84710e8c64cdaada823.256p.jpg,Full,,ATX,Black
GameMax RGB Pro,850,109.99,80+ Gold,No Match,N/A,N/A,0,https://m.media-amazon.com/images/I/51+4OdlO1yL.jpg,Full,,ATX,White
Super Flower Leadex III Gold UP,750,109.99,80+ Gold,super flower leadex gold,A-,"Chinese caps, 20AWG gauges on the EPS/PCIe cables; 5VSB regulation doesn't quite hit A tier specifications.",109.8,//cdna.pcpartpicker.com/static/forever/images/product/72e79c9c6bb8b0b3bf0eba2806d3142b.256p.jpg,Full,,ATX,Black
Super Flower Zillion FG,850,109.99,80+ Gold,super flower zillion fg gold atx 3 1,B-*,,112.6,//cdna.pcpartpicker.com/static/forever/images/product/d8adb266604520991852450e39838d13.256p.jpg,Full,,ATX,Black
EVGA 500 BA,500,109.99,80+ Bronze,evga b series b3,C-,OCP on 12V doesnt exist. OPP is set too high. Sleeve bearing fan.,71.92727272727272,//cdna.pcpartpicker.com/static/forever/images/product/fa0e062f5074fdd223bc02875666a43a.256p.jpg,No,,ATX,Black
Gigabyte UD850GM-A,850,109.99,80+ Gold,gigabyte ultra durable ud gm a pg5,C+*,,74.22857142857143,//cdna.pcpartpicker.com/static/forever/images/product/55936b13c037127faa37d94d6879a404.256p.jpg,Full,,ATX,Black
Silverstone SFX,450,111.14,80+ Bronze,silverstone extreme sfx sfx l bronze,C-,,113.2,https://images-eu.ssl-images-amazon.com/images/I/51YKrs7LtqL.jpg,No,,SFX,Black
Silverstone FX350-G,350,112.14,80+ Gold,silverstone strider st es,E,,74.33333333333333,https://m.media-amazon.com/images/I/51C+mckVn5L.jpg,No,,Flex ATX,Black
Silverstone SX500-G,500,113.22,80+ Gold,silverstone sfx sx,C+,Protechnic Electric sleeve bearing fan.,90.68108108108108,//cdna.pcpartpicker.com/static/forever/images/product/c011e909a23ae134119f5be65fe97630.256p.jpg,Full,,SFX,Black
FSP Group FSP300-60LG,300,113.59,80+ Bronze,No Match,N/A,N/A,0,https://images-na.ssl-images-amazon.com/images/I/411h-PthHzL.jpg,No,,Mini ITX,Black
FSP Group FSP300-60LG-5K,300,113.74,80+ Bronze,No Match,N/A,N/A,0,https://images-eu.ssl-images-amazon.com/images/I/413Go7ruwJL.jpg,No,,Flex ATX,Silver
CoolMax ZX-700,700,113.96,80+,No Match,N/A,N/A,0,https://m.media-amazon.com/images/I/41hcZqZyVJL.jpg,No,,ATX,
Antec Earthwatts Green,430,114.64,80+ Bronze,No Match,N/A,N/A,0,https://images-na.ssl-images-amazon.com/images/I/51BKVhdfgoL.jpg,No,,ATX,
Corsair RM750,750,114.99,80+ Gold,corsair rm e 2022,B+,"750/850W: 140mm, 1000/1200W: 150mm. 2023 version includes 12VHPWR cable. Early reports of coil whine and premature failures/DOAs, but supposedly fixed.",88.4,//cdna.pcpartpicker.com/static/forever/images/product/8912b48548fca5ee3606a5d93772928a.256p.jpg,Full,,ATX,White / Black
Thermaltake EVO_Blue,650,114.99,80+ Gold,thermaltake tr2 gold,C+,,93.61538461538461,https://m.media-amazon.com/images/I/41RtYnCKMjL.jpg,Semi,,ATX,
Rosewill PMG750,750,114.99,80+ Gold,rosewill pmg,C*,No info,97.28888888888889,https://m.media-amazon.com/images/I/51GiqyALi1L.jpg,Full,,ATX,Black
MSI MAG A750GL PCIE5 II,750,115.0,80+ Gold,msi mag a gl pcie5 ii,B*,Sticker on unit is slightly different w/ yellow corner accents. All dimensions and specs are otherwise the same.,101.10909090909091,//cdna.pcpartpicker.com/static/forever/images/product/17294c7b6ef21cfb0b52097e46cfd9b3.256p.jpg,Full,,ATX,Black
RAIJINTEK AMPERE,850,115.0,80+ Platinum,No Match,N/A,N/A,0,https://m.media-amazon.com/images/I/41nvFQkjvgL.jpg,Full,,ATX,Black
Thermaltake Toughpower GF3 TT Premium,750,115.98,80+ Gold,thermaltake toughpower gold,B-,,110.4,//cdna.pcpartpicker.com/static/forever/images/product/1c56a310e3d7c5f406957f424faac6c5.256p.jpg,Full,,ATX,Black
Lian Li SP750,750,115.99,80+ Gold,lian li sp,B,Doesn't see the same problem as the 850W variant because of its lower capacity.,94.95652173913044,//cdna.pcpartpicker.com/static/forever/images/product/db355edbb98f99d3bb64db1cd6a8e179.256p.jpg,Full,,SFX,White
be quiet! Pure Power 12,850,115.99,80+ Gold,be quiet pure power 12 m,A,Not to be confused with the non-modular Pure Power 12.,110.8,//cdna.pcpartpicker.com/static/forever/images/product/b43737a5d4e955c807956044ec1b0f07.256p.jpg,No,,ATX,Black
PC Power & Cooling Silencer MK III,750,118.49,80+ Gold,No Match,N/A,N/A,0,https://m.media-amazon.com/images/I/513a3efEvkL.jpg,Semi,,ATX,
Gigabyte UD-GM PG5,750,118.51,80+ Gold,gigabyte ultra durable ud gm pg5 rev 1 0,C+*,,114.0,//cdna.pcpartpicker.com/static/forever/images/product/49197507b4f14b631967e6162e757357.256p.jpg,Full,,ATX,Black
SeaSonic SSP-300SUG,300,119.0,80+ Gold,No Match,N/A,N/A,0,https://m.media-amazon.com/images/I/51YUOjSvMCL.jpg,No,,Flex ATX,Silver
Asus Prime AP-750G,750,119.99,80+ Gold,asus prime gold,B+,,108.0,//cdna.pcpartpicker.com/static/forever/images/product/72b335278eb86295c6d48f3b1794efa5.256p.jpg,Full,,ATX,White / Black
Rosewill CMG1000G5,1000,119.99,80+ Gold,rosewill cmg g5,A*,,93.84848484848484,https://m.media-amazon.com/images/I/41nIHCPN5hL.jpg,Full,,ATX,Black
Gigabyte UD850GM-A PG5,850,119.99,80+ Gold,gigabyte ultra durable ud gm a pg5,C+*,,80.57777777777777,//cdna.pcpartpicker.com/static/forever/images/product/3917a17b7e994231a7b22410ed980856.256p.jpg,Full,,ATX,Black
Razer Katana Chroma,850,119.99,80+ Platinum,razer katana chroma,A,"Semi-digital, Razer Chroma integration with other Razer products.",109.8,https://m.media-amazon.com/images/I/417loofq0RL.jpg,Full,,ATX,Black
GAMDIAS HELIOS P2-1000G,1000,119.99,80+ Gold,gamdias helios p2,B+,,109.4,https://m.media-amazon.com/images/I/41BUUTKqNbL.jpg,No,,ATX,Black
Lian Li EDGE GOLD,850,120.99,80+ Gold,No Match,N/A,N/A,0,//cdna.pcpartpicker.com/static/forever/images/product/f3d49f21c4bbc671af07e2be31f23b94.256p.jpg,Full,,ATX,White
MSI MAG A850GL PCIE5,850,121.99,80+ Gold,msi mag a gl pcie5,B,"Solid electrical performance, let down by poorly tuned protections, mediocre transient response, and a low quality fan.",99.07368421052631,//cdna.pcpartpicker.com/static/forever/images/product/79be60ce3783b8918a1c0940d3e4ff19.256p.jpg,Full,,ATX,Black
Lian Li SP,750,123.96,80+ Gold,lian li sp,B,Doesn't see the same problem as the 850W variant because of its lower capacity.,108.0,//cdna.pcpartpicker.com/static/forever/images/product/7a9dedea22aa3c48ba0ae4effe9b21a3.256p.jpg,Full,,SFX,Black
be quiet! SFX Power 3 450,450,124.41,80+ Bronze,be quiet sfx power 3,C,,110.0,//cdna.pcpartpicker.com/static/forever/images/product/6f22b32ac4c2844cc76bbee6ef798d01.256p.jpg,No,,SFX,Black
be quiet! Pure Power 12 M,850,124.9,80+ Gold,be quiet pure power 12 m,A,Not to be confused with the non-modular Pure Power 12.,110.8,//cdna.pcpartpicker.com/static/forever/images/product/58f82e34238ad2132a69775300daa503.256p.jpg,Full,,ATX,Black
Antec Earthwatts,500,124.98,80+ Bronze,No Match,N/A,N/A,0,https://m.media-amazon.com/images/I/51EMODQvP9L.jpg,No,,ATX,
Corsair RM850,850,124.99,80+ Gold,corsair rm e 2022,B+,"750/850W: 140mm, 1000/1200W: 150mm. 2023 version includes 12VHPWR cable. Early reports of coil whine and premature failures/DOAs, but supposedly fixed.",88.4,//cdna.pcpartpicker.com/static/forever/images/product/1752baa3ddb162df098cf33b0b6eeae3.256p.jpg,Full,,ATX,White / Black
NZXT C850 (2024),850,124.99,80+ Gold,nzxt c series gold atx 3 1 2024,A+,Available in black and white,82.13846153846154,//cdna.pcpartpicker.com/static/forever/images/product/c0060ae80a7b71686da1ca92324d0f68.256p.jpg,Full,,ATX,Black
Asus ROG Strix,750,124.99,80+ Gold,asus rog strix aura gold,A-,,109.8,//cdna.pcpartpicker.com/static/forever/images/product/ba70a2eb144a1dafb714c0f37eaabc30.256p.jpg,Full,,ATX,Black / Red
EVGA 1000 GQ,1000,125.15,80+ Gold,evga supernova gq,B,,109.4,//cdna.pcpartpicker.com/static/forever/images/product/ed2b65163a469142ad0460bcfadf4850.256p.jpg,Semi,,ATX,
Inter-Tech Argus RGB II,500,125.5,80+ Bronze,No Match,N/A,N/A,0,https://m.media-amazon.com/images/I/41siUATjegS.jpg,No,,ATX,Black
Silverstone ST75F-GS-V3,750,125.56,80+ Gold,silverstone viva gold,B+,,90.68148148148148,https://m.media-amazon.com/images/I/51hx-kcJoAL.jpg,Full,,ATX,Black
Antec CSK,550,126.9,80+ Bronze,antec atom cuprum strike csk bronze,E,,113.0,//cdna.pcpartpicker.com/static/forever/images/product/3f28cb7bc95342d59cf7f6bb31afb04f.256p.jpg,No,,ATX,Black / Yellow
Silverstone SFX,500,127.25,80+ Gold,silverstone extreme sfx sfx l rz gold,B*,"12V-2x6 connector on modular panel, but no included cable for it. Can be bought separately. Potentially to only need 150% excursions?",112.4,//cdna.pcpartpicker.com/static/forever/images/product/25aa74d682bfbb478cc7089f30086e4b.256p.jpg,Full,,SFX,Black
Silverstone ST85F-GS-V2,850,127.37,80+ Gold,silverstone strider stf gs v3,B*,,78.72307692307692,https://m.media-amazon.com/images/I/51ycPIhE-bL.jpg,Full,,ATX,
Cooler Master MWE White V2 230V,700,127.62,80+,cooler master mwe v2 white,B,,111.2,//cdna.pcpartpicker.com/static/forever/images/product/25b04bd15445e49122eab536acaee519.256p.jpg,No,,ATX,Black
EVGA 750 GQ,750,128.19,80+ Gold,evga supernova gq,C,,109.4,//cdna.pcpartpicker.com/static/forever/images/product/24ef44cdf0bbd6dbfd72bb1bd22f63a5.256p.jpg,Semi,,ATX,
SeaSonic SS-600ES,600,129.01,80+ Bronze,seasonic a12,F,,88.4,//cdna.pcpartpicker.com/static/forever/images/product/6ec3f9d0b0d7ae18e60ae9ccd0985872.256p.jpg,No,,ATX,Gray
SeaSonic Focus GX V4 ATX 3 (2024),750,129.9,80+ Gold,seasonic focus gx v4 atx 3 1,A-,"Black model has white line accents, compared to V3. Stupidly high inrush current, mediocre transient response, minor rails' OCP needs tuning.",131.6,//cdna.pcpartpicker.com/static/forever/images/product/5595266ca881fcc6e5296037a601f47d.256p.jpg,Full,,ATX,Black
Montech CENTURY II,1200,129.9,80+ Gold,montech century ii gold atx 3 1,A,"Good performance and noise profile. High inrush current. OPP and OCP on the minor rails need tuning. Functional, but set high.",111.6,//cdna.pcpartpicker.com/static/forever/images/product/f973a0374020c80c5fb0199771036a12.256p.jpg,Full,,ATX,Black
be quiet! Power Zone 2,750,129.9,80+ Platinum,be quiet power zone 2,B+,First be quiet! PSU with semi-passive operation.,110.2,//cdna.pcpartpicker.com/static/forever/images/product/d04914d2e55a2b07e07ab7e5ddb1c6e9.256p.jpg,Full,,ATX,Black
Thermaltake Toughpower iRGB PLUS 750,750,129.98,80+ Gold,thermaltake toughpower irgb plus gold,A-,OTP claimed; tested working in other GPR-based units in similar configurations.,112.4,//cdna.pcpartpicker.com/static/forever/images/product/36c3f2162cb7c105b5aceb9d291a4ccc.256p.jpg,Full,,ATX,Black
Corsair RM850e (2023),850,129.99,80+ Gold,corsair rm e 2023 gen 5,B+,,96.26666666666665,//cdna.pcpartpicker.com/static/forever/images/product/74e6caafd69bcc53d6e5060a3249248d.256p.jpg,Full,,ATX,Black
Thermaltake Toughpower GF A3 Snow,850,129.99,80+ Gold,thermaltake toughpower gf a3 snow,B,,112.6,//cdna.pcpartpicker.com/static/forever/images/product/f9f65f8de59f21fde47414034b68536c.256p.jpg,Full,,ATX,White
ADATA XPG CYBERCORE,1000,129.99,80+ Platinum,adata xpg cybercore ii,A+,Semi-digital,110.4,//cdna.pcpartpicker.com/static/forever/images/product/1196eea43a85b6a3776208dfa80b3fb6.256p.jpg,Full,,ATX,Black / Silver
MSI MAG A850GL PCIE5 II,850,129.99,80+ Gold,msi mag a gl pcie5 ii,B*,Sticker on unit is slightly different w/ yellow corner accents. All dimensions and specs are otherwise the same.,101.10909090909091,//cdna.pcpartpicker.com/static/forever/images/product/17294c7b6ef21cfb0b52097e46cfd9b3.256p.jpg,Full,,ATX,Black
Vetroo GV1000,1000,129.99,80+ Gold,vetroo gv g5 2024 atx 3 1,B+,"Advertised as ATX 3.1. Platform has poor transient response in 200% ATX 3.1 test, weak 3.3V load regulation, and high-set OCP on minor rails.",73.15789473684211,//cdna.pcpartpicker.com/static/forever/images/product/e113f34642a10aa8278d556375de6e02.256p.jpg,Full,,ATX,White
Vetroo GV1000,1000,129.99,80+ Gold,vetroo gv g5 2024 atx 3 1,B+,"Advertised as ATX 3.1. Platform has poor transient response in 200% ATX 3.1 test, weak 3.3V load regulation, and high-set OCP on minor rails.",73.15789473684211,//cdna.pcpartpicker.com/static/forever/images/product/8d7da7ff110b4a05581835290ee3c431.256p.jpg,Full,,ATX,Black
Super Flower Leadex III Gold UP,850,129.99,80+ Gold,super flower leadex iii gold up atx 3 1 ge,A,"850W has weak 3.3V transient response, but otherwise works well. 1000W seems to lack proper efficiency certifications, but meets gold criteria.",103.8,//cdna.pcpartpicker.com/static/forever/images/product/72e79c9c6bb8b0b3bf0eba2806d3142b.256p.jpg,Full,,ATX,Black
Vetroo GV1000,1000,129.99,80+ Gold,vetroo gv g5 2024 atx 3 1,B+,"Advertised as ATX 3.1. Platform has poor transient response in 200% ATX 3.1 test, weak 3.3V load regulation, and high-set OCP on minor rails.",73.15789473684211,https://m.media-amazon.com/images/I/416mCWEAUbL.jpg,Full,,ATX,Pink
ASRock Steel Legend SL-1000G,1000,129.99,80+ Gold,asrock steel legend sl g,B+,"1000W model has poor transient response on 12V under 200% spike, other models mediocre. 850/1000W avail. in white.",106.45217391304348,//cdna.pcpartpicker.com/static/forever/images/product/0831b235eea9461d59da3b218e57f673.256p.jpg,Full,,ATX,Black
Rosewill CMG1200G5,1200,129.99,80+ Gold,rosewill cmg g5,A*,,93.84848484848484,https://m.media-amazon.com/images/I/41K78PBR3wL.jpg,Full,,ATX,Black
FSP Group FSP300-57FCB,300,129.99,80+ Gold,No Match,N/A,N/A,0,//cdna.pcpartpicker.com/static/forever/images/product/4abcee7b7ea5902ff86c66a848faae82.256p.jpg,Full,,Flex ATX,Black
FSP Group Hydro PTM PRO,750,129.99,80+ Platinum,fsp fortron sparkle hydro ptm pro,B*,No performance data.,97.6,//cdna.pcpartpicker.com/static/forever/images/product/becfb8f2b8df85a668b54fbb97604ade.256p.jpg,Full,,ATX,Black
In Win P65,650,131.0,80+ Gold,No Match,N/A,N/A,0,https://m.media-amazon.com/images/I/41CRQe2QuwL.jpg,Full,,ATX,Black
MSI MAG A850GL PCIE5,850,132.99,80+ Gold,msi mag a gl pcie5,B,"Solid electrical performance, let down by poorly tuned protections, mediocre transient response, and a low quality fan.",99.07368421052631,//cdna.pcpartpicker.com/static/forever/images/product/eef1b2e0ab31f6cbcbe01d162f44b952.256p.jpg,Full,,ATX,White
SeaSonic CORE GX ATX 3 (2024),850,132.99,80+ Gold,seasonic core gx atx 3 0,B-,"Good electrical performance and decent component quality, however OCP on the minor rails is set way too high, particularly on 5VSB (over 200%)",130.8,//cdna.pcpartpicker.com/static/forever/images/product/2a8c5efeb85017829c46d8fe18d71ca6.256p.jpg,Full,,ATX,Black
NZXT E850,850,133.57,80+ Gold,nzxt e series,A,Added MCU and secondary supervisor IC.,70.13846153846154,//cdna.pcpartpicker.com/static/forever/images/product/5fe85d17a904cdca689afa2a32d163c1.256p.jpg,Full,,ATX,Black
Silverstone DA750 Gold,750,133.99,80+ Gold,silverstone viva gold,B+,,90.68148148148148,//cdna.pcpartpicker.com/static/forever/images/product/86e43d07e104412be4e0e875349a9ec1.256p.jpg,Full,,ATX,Black / White
SeaSonic Platinum,600,134.69,80+ Bronze,seasonic a12,F,,88.4,/static/forever/img/no-image.png,No,,ATX,
be quiet! Pure Power 13 M,850,134.9,80+ Gold,be quiet pure power 13 m,A,Excellent noise profile.,110.8,https://m.media-amazon.com/images/I/51NcpqwxV1L.jpg,Full,,ATX,Black
ASRock Steel Legend SL-850GW,850,134.99,80+ Gold,asrock steel legend sl g,B+,"1000W model has poor transient response on 12V under 200% spike, other models mediocre. 850/1000W avail. in white.",106.45217391304348,//cdna.pcpartpicker.com/static/forever/images/product/f0d0913927dbad7a2da55bd5a2100f43.256p.jpg,Full,,ATX,White
Thermaltake Toughpower GF A3 - TT Premium Edition,1050,135.99,80+ Gold,thermaltake toughpower gf a3 n amer,B-,"Unnanounced OEM swap for North American market. Technically invalid 80 Plus certification, but did qualify for Gold in testing, as advertised.",121.88888888888889,//cdna.pcpartpicker.com/static/forever/images/product/fde35fc1c95bec77a83fb6bebf236edb.256p.jpg,Full,,ATX,Black
Thermaltake Smart RGB 230V,500,136.0,80+,thermaltake smart rgb,D,,110.2,//cdna.pcpartpicker.com/static/forever/images/product/e13ae98063169c383ecf961260edc88b.256p.jpg,No,,ATX,Black
be quiet! TFX Power 3 300,300,136.18,80+ Gold,No Match,N/A,N/A,0,//cdna.pcpartpicker.com/static/forever/images/product/26f4e1e59c28ce6c0a4dd6e61845d41a.256p.jpg,No,,TFX,Black
Thermaltake TR2 S,700,136.83,80+,thermaltake tr2 s dc dc ver,C-*,"Flat black cables, model PS-TRS-[Wattage]NNSAW. Claims DC-DC and all protections. Possibly double-sourced with HKC.",111.4,https://m.media-amazon.com/images/I/51uuHGYKMML.jpg,No,,ATX,Black
Lian Li SP850,850,138.99,80+ Gold,lian li sp,F,Fatal design flaw that causes an X cap to melt under 100VAC; potential fire hazard. Two samples also died during LTT Labs testing.,94.95652173913044,//cdna.pcpartpicker.com/static/forever/images/product/e9b300b7848e40028671ae29d4b07cb8.256p.jpg,Full,,SFX,Black
SeaSonic Focus GX V4 ATX 3 (2024),750,138.99,80+ Gold,seasonic focus gx v4 atx 3 1,A-,"Black model has white line accents, compared to V3. Stupidly high inrush current, mediocre transient response, minor rails' OCP needs tuning.",131.6,//cdna.pcpartpicker.com/static/forever/images/product/95e33387277fc0fc6e46c69add179ba1.256p.jpg,Full,,ATX,White
