located Name,Wattage,Price,Efficiency,Matched Tier Model,Tier,Matched Tier Model Info,Similarity,Image URL,modularity,Product URL,size,color,atxver
Vida Lite,500,18.98,,No Match,N/A,No Match Info,0,//cdna.pcpartpicker.com/static/forever/images/product/2e70d7c31040c26b20fc9a4ef5692f29.256p.jpg,No,,ATX,Black,N/A
Tecnoware Free Silent,500,22.38,,No Match,N/A,No Match Info,0,https://m.media-amazon.com/images/I/41suxKFcg1L.jpg,No,,ATX,Black,N/A
Vida Lite,650,26.99,,No Match,N/A,No Match Info,0,//cdna.pcpartpicker.com/static/forever/images/product/9ca588b33f5a51a45ef89b31eec788e6.256p.jpg,No,,ATX,Black,N/A
GameMax Rampage,500,29.99,80+ Bronze,No Match,N/A,No Match Info,0,//cdna.pcpartpicker.com/static/forever/images/product/36f7695e170ad21584a332452b323b27.256p.jpg,No,,ATX,Black,N/A
GameMax Rampage,600,30.99,80+ Bronze,No Match,N/A,No Match Info,0,//cdna.pcpartpicker.com/static/forever/images/product/d74af8f15ae83811c0da087df974a51f.256p.jpg,No,,ATX,Black,N/A
GameMax GT,300,31.99,80+ Bronze,No Match,N/A,No Match Info,0,//cdna.pcpartpicker.com/static/forever/images/product/5a6606541a522f77579a02ff19a5b5af.256p.jpg,No,,TFX,Silver,N/A
Deepcool PF500 230V,500,33.98,80+,deepcool gamerstorm pf,E,"Doesn't claim necessary protections, unknown components such as the capacitors.",90.82727272727271,//cdna.pcpartpicker.com/static/forever/images/product/0ccfb276c4b37497ed9c21ef0aca236a.256p.jpg,No,,ATX,Black,ATX 2.x
Deepcool PF400 230V,400,36.82,80+,deepcool gamerstorm pf,E,"Doesn't claim necessary protections, unknown components such as the capacitors.",90.82727272727271,//cdna.pcpartpicker.com/static/forever/images/product/1ccbaf569f8ecca5b7d8e00162e6be89.256p.jpg,No,,ATX,Black,ATX 2.x
GameMax GS,300,36.95,80+ Bronze,No Match,N/A,No Match Info,0,//cdna.pcpartpicker.com/static/forever/images/product/7ba328d57a7266a21ad640eb2355f003.256p.jpg,No,,SFX,Silver,N/A
Deepcool PF600 230V,600,37.98,80+,deepcool gamerstorm pf,E,"Doesn't claim necessary protections, unknown components such as the capacitors.",90.82727272727271,//cdna.pcpartpicker.com/static/forever/images/product/5559b24c0248255b164057c188303fdf.256p.jpg,No,,ATX,Black,ATX 2.x
MSI MAG A550BN,550,37.99,80+ Bronze,msi mag a bn,C,Capacitors and fans appear to be variable based on region/batch.,101.71538461538461,https://m.media-amazon.com/images/I/51VZJ8DVX-L.jpg,No,,ATX,Black,ATX 2.x
Aerocool Integrator,500,37.99,80+ Bronze,aerocool ae,E,Overall very low build quality,112.26052631578948,//cdna.pcpartpicker.com/static/forever/images/product/92f02e5cf3c4f6897d314beb5ea48422.256p.jpg,No,,ATX,Black,ATX 2.x
GameMax GP,400,41.95,80+ Bronze,No Match,N/A,No Match Info,0,//cdna.pcpartpicker.com/static/forever/images/product/6d295e41983c7f231ee72748ec8f92d7.256p.jpg,No,,ATX,Black,N/A
Aerocool Integrator,600,41.99,80+ Bronze,aerocool ae,E,Overall very low build quality,112.26052631578948,//cdna.pcpartpicker.com/static/forever/images/product/ad5ab76e9b447df20f37e90642aec899.256p.jpg,No,,ATX,Black,ATX 2.x
YEYIAN Raiden RGB,650,42.19,80+ Bronze,yeyian raiden bronze,F,Does not claim certain safety protection circuits which is a major deficiency.,115.66666666666667,https://m.media-amazon.com/images/I/51+P-EhS1jL.jpg,No,,ATX,Black,ATX 2.x
Aerocool Integrator,700,42.96,80+ Bronze,aerocool ae,E,Overall very low build quality,112.26052631578948,//cdna.pcpartpicker.com/static/forever/images/product/4c04fbb8bc3c8c65fbf3a6152ce351f6.256p.jpg,No,,ATX,Black,ATX 2.x
MSI MAG A650BN,650,42.99,80+ Bronze,msi mag a bn,C,Capacitors and fans appear to be variable based on region/batch.,101.71538461538461,//cdna.pcpartpicker.com/static/forever/images/product/3148f884b77b2d7abee3a3e0ad72cf73.256p.jpg,No,,ATX,Black,ATX 2.x
GameMax GP,500,42.99,80+ Bronze,No Match,N/A,No Match Info,0,//cdna.pcpartpicker.com/static/forever/images/product/1dac3bab43bfcf462070fb58e1fb2ffa.256p.jpg,No,,ATX,Black,N/A
ENDORFY Vero L5,500,43.93,80+ Bronze,endorfy vero l6,C+,"Good electrical performance for the category, decent component quality, protections are set reasonably.",122.58333333333333,//cdna.pcpartpicker.com/static/forever/images/product/d2e2490a078d64e82a1181d7e43afa05.256p.jpg,No,,ATX,Black,ATX 3.x
Deepcool PL750D,750,43.94,80+ Bronze,deepcool gamerstorm pl d,C,"Subpar component quality, with highly set protections and OOS 3.3V transient response.",88.76521739130435,//cdna.pcpartpicker.com/static/forever/images/product/9ee96af4fbfe40de451a9d3db9ba7e9a.256p.jpg,No,,ATX,Black,ATX 3.x
Xilence XP400R6,400,47.62,,No Match,N/A,No Match Info,0,https://m.media-amazon.com/images/I/41xDKYAGohL.jpg,No,,ATX,Black / Red,N/A
GameMax Rampage,600,47.95,80+ Bronze,No Match,N/A,No Match Info,0,//cdna.pcpartpicker.com/static/forever/images/product/60f1b3103375b76358b9d59d90ad949d.256p.jpg,No,,ATX,White,N/A
GameMax RGB Rainbow,550,47.99,80+ Gold,No Match,N/A,No Match Info,0,//cdna.pcpartpicker.com/static/forever/images/product/3d9c70e9fce36a40c8d35f3bd7a0f52b.256p.jpg,Full,,ATX,Black,N/A
Cooler Master MWE Bronze 650 V3 230V,650,48.94,80+ Bronze,cooler master mwe v3 atx 3 1 bronze 230v,C,"Basically G1208 updated to ATX 3.1, no 12VHPWR.",129.75,//cdna.pcpartpicker.com/static/forever/images/product/24334985b6ed3173495aab3744b6d9de.256p.jpg,No,,ATX,Black,ATX 2.x
Corsair CX (2023),550,49.99,80+ Bronze,corsair cx non modular 2023 black label,D,"White ""CX"" lettering on black label; Identical to the CV aside from exterior design.",139.7,//cdna.pcpartpicker.com/static/forever/images/product/5c9986f2ca555182c65ca3541ec840ed.256p.jpg,No,,ATX,Black,ATX 2.x
Gigabyte P550SS,550,49.99,80+ Silver,gigabyte p ss,C*,"Not enough extensive testing; platform is unknown but looks similar to the Cougar GEC, which uses a costdown 2008 platform.",114.36428571428571,https://m.media-amazon.com/images/I/31FGgZumG9L.jpg,No,,ATX,White,ATX 2.x
ENDORFY Vero L5,600,51.0,80+ Bronze,endorfy vero l6,C+,"Good electrical performance for the category, decent component quality, protections are set reasonably.",122.58333333333333,//cdna.pcpartpicker.com/static/forever/images/product/bce8470b4d5e51c9fe52d7e17af4c39d.256p.jpg,No,,ATX,Black,ATX 3.x
Gigabyte P750BS (230V),750,51.94,80+ Bronze,gigabyte p bs,C*,No info,107.22142857142858,//cdna.pcpartpicker.com/static/forever/images/product/14ee26e6cba2d3b6f8b1cd283b0e050a.256p.jpg,No,,ATX,Black,ATX 2.x
Gigabyte P550SS,550,52.43,80+ Silver,gigabyte p ss,C*,"Not enough extensive testing; platform is unknown but looks similar to the Cougar GEC, which uses a costdown 2008 platform.",114.36428571428571,//cdna.pcpartpicker.com/static/forever/images/product/f8335bb0ae22c54160c81c9933481d0d.256p.jpg,No,,ATX,Black,ATX 2.x
Deepcool PF700 230V,700,52.82,80+,deepcool gamerstorm pf,E,"Doesn't claim necessary protections, unknown components such as the capacitors.",91.32727272727271,//cdna.pcpartpicker.com/static/forever/images/product/eaf049054c02a544104903a9f58173b3.256p.jpg,No,,ATX,Black,ATX 2.x
Cooler Master MWE Bronze 750 V3 230V,750,52.98,80+ Bronze,cooler master mwe v3 atx 3 1 bronze 230v,C-,Basically G1208 updated to ATX 3.1; broke during 5V SCP. Possible bad sample? No 12VHPWR.,129.75,//cdna.pcpartpicker.com/static/forever/images/product/90ffdff83511b0f42131330356baba97.256p.jpg,No,,ATX,Black,ATX 2.x
Cooler Master MWE Bronze 550 V3 230V,550,53.94,80+ Bronze,cooler master mwe v3 atx 3 1 bronze 230v,C,"Basically G1208 updated to ATX 3.1, no 12VHPWR.",129.75,//cdna.pcpartpicker.com/static/forever/images/product/6d7e86a33d1ecefd471ef7581b99f447.256p.jpg,No,,ATX,Black,ATX 2.x
Corsair CX (2023),650,54.86,80+ Bronze,corsair cx non modular 2023 black label,C,,139.7,//cdna.pcpartpicker.com/static/forever/images/product/c058ff0ffb542302d5b1c75cf8658ecd.256p.jpg,No,,ATX,Black,ATX 2.x
Silverstone SST-TX300,300,55.47,80+ Bronze,No Match,N/A,No Match Info,0,//cdna.pcpartpicker.com/static/forever/images/product/ed4d5da91285cfe1f9360ff41b975c97.256p.jpg,No,,TFX,Black,N/A
Antec VP PLUS,500,55.61,80+,antec atom vp plus,E,,115.9,//cdna.pcpartpicker.com/static/forever/images/product/53075d6ce9d083bdd6732c82f597ee85.256p.jpg,No,,ATX,Black,ATX 2.x
Mars Gaming MPIII750,750,55.9,,No Match,N/A,No Match Info,0,/static/forever/img/no-image.png,No,,ATX,White,N/A
Antec VP PLUS,550,56.95,80+,antec atom vp plus,E,,115.9,//cdna.pcpartpicker.com/static/forever/images/product/df7265af0626aa2158a104bfa7396569.256p.jpg,No,,ATX,Black,ATX 2.x
Antec VP PLUS,550,57.28,80+,antec atom vp plus,E,,115.9,//cdna.pcpartpicker.com/static/forever/images/product/eab7a58ca2772caf04e9a8fa00254430.256p.jpg,No,,ATX,Black,ATX 2.x
Xilence XP600R6,600,57.38,,No Match,N/A,No Match Info,0,//cdna.pcpartpicker.com/static/forever/images/product/5b1ec52685b70f9f36d952da40e897e5.256p.jpg,No,,ATX,Black / Red,N/A
ENDORFY Vero L5,700,57.64,80+ Bronze,endorfy vero l6,C+,"Good electrical performance for the category, decent component quality, protections are set reasonably.",122.58333333333333,//cdna.pcpartpicker.com/static/forever/images/product/d2e2490a078d64e82a1181d7e43afa05.256p.jpg,No,,ATX,Black,ATX 3.x
Antec CSK,550,58.0,80+ Bronze,antec atom cuprum strike csk dc,C-,DC-DC variant of the CSK Bronze; only 750W has 300W 12VHPWR.,120.05,//cdna.pcpartpicker.com/static/forever/images/product/3f28cb7bc95342d59cf7f6bb31afb04f.256p.jpg,No,,ATX,Black / Yellow,ATX 2.x
Corsair CX (2023),750,58.97,80+ Bronze,corsair cx non modular 2023 black label,C,,139.7,//cdna.pcpartpicker.com/static/forever/images/product/a13b3baedca8b58d4ce5008b7bf5d357.256p.jpg,No,,ATX,Black,ATX 2.x
MSI MAG A750BN PCIE5,750,59.99,80+ Bronze,msi mag a bn pcie5,C,"A-BN with 300W 12VHPWR connection. Claims sleeve bearing, unknown quality fan. Does not claim ATX 3.0 compliance.",108.37368421052632,//cdna.pcpartpicker.com/static/forever/images/product/0e6a8954c4ddd51ffeaac409a3b2f9f7.256p.jpg,No,,ATX,Black,ATX 2.x
MSI MAG A650BNL,650,59.99,80+ Bronze,msi mag a bnl 230v,F,130mV+ of ripple on all rails (out of spec) at only 60% load; failed to meet even 80+ Bronze. See Rear Shot and Output Specification Label.,104.86428571428571,//cdna.pcpartpicker.com/static/forever/images/product/be6187c3475090018df75237232e96ba.256p.jpg,No,,ATX,White,ATX 2.x
Corsair CX550 (2017),550,60.54,80+ Bronze,corsair vs gray label,E,"Grey label; OCP doesn't work properly, allowing the voltages to fall out of spec, very poor ripple suppression on 5V, failed transient testing on 3.3V",105.55,https://m.media-amazon.com/images/I/41+OLJv1vRL.jpg,No,,ATX,,ATX 2.x
Xilence XP650R6.2,650,61.34,80+,xilence performance a xp r5,E,,82.68333333333334,//cdna.pcpartpicker.com/static/forever/images/product/8aed79a0f8cf935cc284e0be6ac7ddc8.256p.jpg,No,,ATX,Black,ATX 2.x
Cooler Master MWE Gold V3,550,61.94,80+ Gold,cooler master mwe v3 atx 3 1 gold non mod,B,"Modified MWE Bronze V3, same as G Gold V2.",129.9,//cdna.pcpartpicker.com/static/forever/images/product/379fff1d502bae60c5ab147c28f8155b.256p.jpg,No,,ATX,Black,ATX 2.x
Cooler Master Elite NEX White W600 Black Mesh 230V,600,63.29,80+,cooler master elite nex 230v,E,,128.65,https://m.media-amazon.com/images/I/51pT3Drq0UL.jpg,No,,ATX,Black,ATX 2.x
Cooler Master MWE Gold V3,650,63.94,80+ Gold,cooler master mwe v3 atx 3 1 gold non mod,B,"Modified MWE Bronze V3, same as G Gold V2.",129.9,//cdna.pcpartpicker.com/static/forever/images/product/d839175b272fa3a5f76a7844a79a05f4.256p.jpg,No,,ATX,Black,ATX 2.x
LC-Power OFFICE SERIES,600,64.0,,No Match,N/A,No Match Info,0,https://m.media-amazon.com/images/I/51LsIp7TRyL.jpg,No,,ATX,Black,N/A
Cooler Master MWE White V2 230V,550,64.67,80+ Bronze,cooler master mwe v2 white,B,,137.8,//cdna.pcpartpicker.com/static/forever/images/product/951d679bf960d065c028bc14cc8424da.256p.jpg,No,,ATX,Black / White,ATX 2.x
Thermaltake TR2 S,600,65.34,80+,thermaltake tr2 s dc dc ver,C-*,"Flat black cables, model PS-TRS-[Wattage]NNSAW. Claims DC-DC and all protections. Possibly double-sourced with HKC.",128.85,//cdna.pcpartpicker.com/static/forever/images/product/a2dbc1855aafadffeb4aedfb06e169f9.256p.jpg,No,,ATX,Black,ATX 2.x
Silverstone ATTIS 650R,650,65.47,80+ Bronze,silverstone attis bronze,F,Does not claim OCP. Need a review/teardown before tiering.,116.37948717948719,//cdna.pcpartpicker.com/static/forever/images/product/b762d08de0eba1a712301fe2254de011.256p.jpg,No,,ATX,Black,ATX 3.x
Xilence XP850R10,850,65.94,80+ Bronze,xilence gaming bronze,E,"Claims to be DC-DC, but internal shots show otherwise; false advertising.",87.91956521739131,https://m.media-amazon.com/images/I/41aRAw2wd7L.jpg,No,,ATX,Black / Red,ATX 2.x
Chieftec GPS-600A8,600,66.78,80+,chieftec chieftronic eon zpu s,E,Voltage regulation is out of ATX specifications on the minor rails; also not independently regulated.,80.53846153846155,https://m.media-amazon.com/images/I/51hWQVa0+HL.jpg,No,,ATX,,ATX 2.x
Thermaltake TR2 S,700,68.42,80+,thermaltake tr2 s dc dc ver,C-*,"Flat black cables, model PS-TRS-[Wattage]NNSAW. Claims DC-DC and all protections. Possibly double-sourced with HKC.",128.85,https://m.media-amazon.com/images/I/51uuHGYKMML.jpg,No,,ATX,Black,ATX 2.x
Thermaltake Smart,600,68.48,80+,thermaltake smart white label,F,"Black casing, white sticker. Unknown number of suppliers for this unit. Versions that have been tested have malfunctioning OCP, OPP, and SCP.",136.45,https://images-eu.ssl-images-amazon.com/images/I/51Ih1TB6nFL.jpg,No,,ATX,,ATX 2.x
Cooler Master Elite NEX White W700 Black Mesh 230V,700,68.94,80+,cooler master elite nex 230v,E,,128.65,https://m.media-amazon.com/images/I/4152nWcvTVL.jpg,No,,ATX,Black,ATX 2.x
be quiet! Pure Power 12,550,69.95,80+ Gold,be quiet pure power 12,B*,"85C bulk caps, rifle bearing fan, non-modular.",118.6,//cdna.pcpartpicker.com/static/forever/images/product/d87e7bd0947bdc6e3587e44c0cd8b1a6.256p.jpg,No,,ATX,Black,ATX 3.x
be quiet! System Power 9 CM,400,69.98,80+ Bronze,be quiet system power 9 cm,C-,,116.3,//cdna.pcpartpicker.com/static/forever/images/product/c7615ed81c90d3e051aca4d771cc78fb.256p.jpg,Semi,,ATX,Black,ATX 2.x
Antec CSK,750,70.0,80+ Bronze,antec atom cuprum strike csk h bronze,E,,117.85,//cdna.pcpartpicker.com/static/forever/images/product/212d4988bf00a133481f4d2c997624f3.256p.jpg,Semi,,ATX,Black / Yellow,ATX 2.x
Silverstone ATTIS 750R,750,71.47,80+ Bronze,silverstone attis bronze,F,Does not claim OCP. Need a review/teardown before tiering.,116.37948717948719,//cdna.pcpartpicker.com/static/forever/images/product/e50081b5963bc08904ea890af28451ba.256p.jpg,No,,ATX,Black,ATX 3.x
NZXT C750 (2023),750,72.98,80+ Bronze,nzxt c series bronze v2 2023,C+,"Same platform as the original C Bronze with slight downgrades in terms of hardware, upgraded fan. See teardown here.",100.18846153846154,https://m.media-amazon.com/images/I/41T1P8UOZTL.jpg,No,,ATX,Black,ATX 2.x
FSP Group VITA BD,750,73.48,80+ Bronze,fsp fortron sparkle vita bd,C*,Has 12VHPWR. Claims ATX 3.1 compliance. See here. Could be cost-down GD. Sleeve bearing fan.,97.92142857142856,//cdna.pcpartpicker.com/static/forever/images/product/c2afba437ec0566ad26c9a2cf5164e86.256p.jpg,No,,ATX,Black,ATX 3.x
Apevia Prestige,800,73.64,80+ Gold,apevia prestige atx 3 0,C+*,"No OTP claimed, no performance or protections data",128.65,https://m.media-amazon.com/images/I/41WXywVNWGL.jpg,No,,ATX,Black,ATX 3.x
Corsair RM650e (2025),650,73.99,,No Match,N/A,No Match Info,0,https://m.media-amazon.com/images/I/41G0n8yq8CL.jpg,Full,,ATX,Black,N/A
Cooler Master MWE Gold V3,750,73.99,80+ Gold,cooler master mwe v3 atx 3 1 gold non mod,B,"Modified MWE Bronze V3, same as G Gold V2.",129.9,//cdna.pcpartpicker.com/static/forever/images/product/8f84152d773d8c3eaf4fbc13c1b9066e.256p.jpg,No,,ATX,Black,ATX 3.x
Silverstone FX350-G,350,74.98,80+ Gold,silverstone strider st es,E,,87.08333333333333,https://m.media-amazon.com/images/I/51C+mckVn5L.jpg,No,,Flex ATX,Black,ATX 2.x
ADATA XPG PYLON,650,75.86,80+ Bronze,adata xpg pylon,C+,650W is technically rated Cybenetics Silver,126.75,//cdna.pcpartpicker.com/static/forever/images/product/76460ae84caf54fbc17dbb87fa05a3dd.256p.jpg,No,,ATX,Black,ATX 2.x
Chieftec GPS-700A8,700,75.93,80+ Bronze,chieftec chieftronic vita bpx s,C-,"3 year warranty; 85C bulk cap, and not one of particularly good quality, either.",81.08846153846154,https://m.media-amazon.com/images/I/51VLmzhKl1L.jpg,No,,ATX,Black / White,ATX 2.x
Xilence XP550R10,550,77.51,80+ Bronze,xilence gaming bronze,E,"Claims to be DC-DC, but internal shots show otherwise; false advertising.",87.91956521739131,https://m.media-amazon.com/images/I/41aRAw2wd7L.jpg,No,,ATX,Black / Red,ATX 2.x
Asus Prime,750,77.84,80+ Bronze,asus tuf bronze,B,Mediocre transient response and low quality caps.,84.89285714285714,//cdna.pcpartpicker.com/static/forever/images/product/ee8811f020d54929e60e22dfaff5219b.256p.jpg,No,,ATX,Black,ATX 2.x
be quiet! SFX Power 3 450,450,77.88,80+ Bronze,be quiet sfx power 3,C*,No information.,117.5,//cdna.pcpartpicker.com/static/forever/images/product/6f22b32ac4c2844cc76bbee6ef798d01.256p.jpg,No,,SFX,Black,ATX 2.x
LC-Power LC6650 V2.3,650,77.97,80+ Bronze,No Match,N/A,No Match Info,0,https://m.media-amazon.com/images/I/41DWC+W3WaL.jpg,No,,ATX,Black,N/A
Montech CENTURY II,850,79.99,80+ Gold,montech century ii gold atx 3 1,A-,"OCP is set high on 3.3V and 5VSB, 5VSB voltage regulation >3% at 4.87%, mediocre excursion response in the 200% test. High inrush current.",129.9,https://m.media-amazon.com/images/I/41ehLaPDbXL.jpg,Full,,ATX,Black,ATX 3.x
be quiet! Pure Power 12,650,79.99,80+ Gold,be quiet pure power 12,B*,"85C bulk caps, rifle bearing fan, non-modular.",118.6,//cdna.pcpartpicker.com/static/forever/images/product/40ab38c15b2b0ac6e8a6e597368c7f57.256p.jpg,No,,ATX,Black,ATX 3.x
be quiet! Pure Power 13 M,550,79.99,80+ Gold,be quiet pure power 13 m,B+,"85C bulk caps, excellent noise profile.",119.7,https://m.media-amazon.com/images/I/41WVogQwQLL.jpg,Full,,ATX,Black,ATX 3.x
Aerocool Integrator Gold,750,79.99,80+ Gold,aerocool integrator gold,B-,,128.45,//cdna.pcpartpicker.com/static/forever/images/product/202c13fbe48289baa417eb64882b7a2e.256p.jpg,Full,,ATX,Black,ATX 2.x
Gigabyte UD-GM PG5,750,80.0,80+ Gold,gigabyte  ud gm pg5 rev 1 0,C+*,,128.3,//cdna.pcpartpicker.com/static/forever/images/product/49197507b4f14b631967e6162e757357.256p.jpg,Full,,ATX,Black,ATX 3.x
NZXT C750,750,80.47,80+ Bronze,nzxt c series bronze v2 2023,C+,"Same platform as the original C Bronze with slight downgrades in terms of hardware, upgraded fan. See teardown here.",10.188461538461539,//cdna.pcpartpicker.com/static/forever/images/product/057565e925af7c2d9b764c5896614162.256p.jpg,Full,,ATX,Black,ATX 2.x
BitFenix Formula Gold 550,550,80.81,80+ Gold,bitfenix formula gold,A,"Design modified for multiple 12V rails: 3 on ≤550W, 4 on ≥650W",125.3,//cdna.pcpartpicker.com/static/forever/images/product/313b10abf57f6786496030e128c00ab1.256p.jpg,No,,ATX,,ATX 2.x
Deepcool PN650M,650,80.98,80+ Gold,deepcool gamerstorm pn m,B,"Can come in white variants. Mediocre fan, no SCP on -12V rail.",88.76521739130435,//cdna.pcpartpicker.com/static/forever/images/product/8b03bb34e6d924a14665d218bfa6802b.256p.jpg,Full,,ATX,Black,ATX 3.x
ENDORFY Supremo FM5,750,82.27,80+ Gold,endorfy supremo gold fm5,C,"Platform visually appears identical to the 916MC platform used in the SAMA XF, which died during OCP testing per LTT Labs. Proceed with caution.",128.55,https://m.media-amazon.com/images/I/41z7L-OwhBL.jpg,Full,,ATX,Black,ATX 2.x
Montech APX,750,82.33,80+,montech apx,C-,,128.55,https://m.media-amazon.com/images/I/41cEcVaK0QL.jpg,No,,ATX,Black,ATX 2.x
Xilence XP650R12,650,82.33,80+ Gold,xilence gaming gold,C*,"Claims meeting 80+ Gold requirements, not certified.",94.36666666666666,https://m.media-amazon.com/images/I/41cYhoxVu3L.jpg,No,,ATX,Black,ATX 2.x
MSI MAG A650GLS PCIE5,650,83.52,80+ Gold,msi mag a gls pcie5,A-,Minor rails' OCP is set lower compared to the CWT-built high-wattage models. 650W is noisier than the 750W on account of using a DBB fan.,109.45,//cdna.pcpartpicker.com/static/forever/images/product/b3f5ce174d631594ae9f8f2dc3b291d1.256p.jpg,Full,,ATX,Black,ATX 3.x
FSP Group VITA BD,850,83.98,80+ Bronze,fsp fortron sparkle vita bd,C*,Has 12VHPWR. Claims ATX 3.1 compliance. See here. Could be cost-down GD. Sleeve bearing fan.,97.92142857142856,//cdna.pcpartpicker.com/static/forever/images/product/c2afba437ec0566ad26c9a2cf5164e86.256p.jpg,No,,ATX,Black,ATX 3.x
Phanteks AMP GH,750,84.95,80+ Gold,phanteks amp gh gold,B,,128.75,//cdna.pcpartpicker.com/static/forever/images/product/f9c9719417368c3b38df8587d03cfa12.256p.jpg,Full,,ATX,Black,ATX 3.x
MSI MAG A750GL PCIE5,750,84.99,80+ Gold,msi mag a gl pcie5,B,"Solid electrical performance, let down by poorly tuned protections, mediocre transient response, and a low quality fan.",107.87368421052632,//cdna.pcpartpicker.com/static/forever/images/product/d8f4d13ba49891eb3929bdddc3d87b4b.256p.jpg,Full,,ATX,Black,ATX 3.x
Gigabyte UD750GM PG5 V2,750,84.99,80+ Gold,gigabyte  ud gm pg5 rev 1 0,C+*,,91.76938775510204,//cdna.pcpartpicker.com/static/forever/images/product/fa5799a3aa935df6c0a31b203ecd0274.256p.jpg,Full,,ATX,Black,ATX 3.x
Silverstone Essential,750,84.99,80+ Gold,silverstone essential et g,B,,126.3,https://images-fe.ssl-images-amazon.com/images/I/511PE5hHeKL.jpg,No,,ATX,Black / Yellow,ATX 2.x
Zalman TXIIv2,500,85.68,80+,zalman tx,C-,,106.26818181818182,https://m.media-amazon.com/images/I/41reGsUwKEL.jpg,No,,ATX,Black,ATX 2.x
Deepcool PN750M,750,86.98,80+ Gold,deepcool gamerstorm pq m v2,A-,"Very high inrush current, poorly tuned protections on the minor rails; otherwise decent electrical performance.",89.41521739130434,//cdna.pcpartpicker.com/static/forever/images/product/ad777eac9eb84ed2bad84c8a824ce892.256p.jpg,Full,,ATX,Black,ATX 3.x
Corsair CX650M (2025),650,88.15,,No Match,N/A,No Match Info,0,//cdna.pcpartpicker.com/static/forever/images/product/54f26cb06be0db54a6e46a8ede08cb65.256p.jpg,Semi,,ATX,Black,N/A
Enermax REVOLUTION III,850,88.46,80+ Gold,enermax revolution iii,A*,"Internal shots are promising, but further testing is needed before tiering.",129.6,https://m.media-amazon.com/images/I/312XPF0wTxL.jpg,Full,,ATX,Black / Gold,ATX 3.x
be quiet! Pure Power 13 M,650,88.72,80+ Gold,be quiet pure power 13 m,B+,"85C bulk caps, excellent noise profile.",119.7,https://m.media-amazon.com/images/I/418l1crumuL.jpg,Full,,ATX,Black,ATX 3.x
be quiet! TFX Power 3 300,300,89.01,80+ Bronze,No Match,N/A,No Match Info,0,//cdna.pcpartpicker.com/static/forever/images/product/26f4e1e59c28ce6c0a4dd6e61845d41a.256p.jpg,No,,TFX,Black,N/A
Thermaltake Toughpower GT,850,89.47,80+ Gold,thermaltake toughpower gt version a fnfag 1,B-*,Circular fan grille; no info aside from internal shots from Thermaltake. Likely even more costdown A07B.,130.15,//cdna.pcpartpicker.com/static/forever/images/product/35f7ab309f09ad2adf51a3971ec77948.256p.jpg,Full,,ATX,Beige,ATX 3.x
Logisys PS480D,480,89.57,,No Match,N/A,No Match Info,0,https://m.media-amazon.com/images/I/41GngthUuoL.jpg,No,,ATX,,N/A
BitFenix Formula Gold 650,650,89.87,80+ Gold,bitfenix formula gold,A,"Design modified for multiple 12V rails: 3 on ≤550W, 4 on ≥650W",125.3,//cdna.pcpartpicker.com/static/forever/images/product/3bf5e735214e4c6b833ac57b4dd36bfb.256p.jpg,No,,ATX,,ATX 2.x
Corsair RM750e (2025),750,89.9,,No Match,N/A,No Match Info,0,//cdna.pcpartpicker.com/static/forever/images/product/8307e191cd38a81dc5dcf709432e21e0.256p.jpg,Full,,ATX,Black,N/A
Gigabyte UD750GM PG5 V2,750,89.99,80+ Gold,gigabyte  ud gm pg5 rev 1 0,C+*,,91.76938775510204,//cdna.pcpartpicker.com/static/forever/images/product/14e81eb15877d5ab721ba0d022fcaf45.256p.jpg,Full,,ATX,White,ATX 3.x
be quiet! Pure Power 12,750,89.99,80+ Gold,be quiet pure power 12,B*,"85C bulk caps, rifle bearing fan, non-modular.",118.6,//cdna.pcpartpicker.com/static/forever/images/product/174e867f0b5ac205af84584ad5bf9b96.256p.jpg,No,,ATX,Black,ATX 3.x
Aerocool Integrator Gold,850,89.99,80+ Gold,aerocool integrator gold,B-,,128.45,//cdna.pcpartpicker.com/static/forever/images/product/c38f4ab2dc0bbc031496e3accb796491.256p.jpg,Full,,ATX,Black,ATX 2.x
Cooler Master MWE White V2 230V,700,90.09,80+,cooler master mwe v2 white,B,,137.8,//cdna.pcpartpicker.com/static/forever/images/product/25b04bd15445e49122eab536acaee519.256p.jpg,No,,ATX,Black,ATX 2.x
be quiet! TFX Power 3 300,300,90.1,80+ Gold,No Match,N/A,No Match Info,0,//cdna.pcpartpicker.com/static/forever/images/product/26f4e1e59c28ce6c0a4dd6e61845d41a.256p.jpg,No,,TFX,Black,N/A
Antec SF850X,850,90.4,80+ Gold,antec atom sf x,B-*,7 year warranty compared to FSP's 10 year warranty for their Dagger Pro ATX 3.0.,85.41666666666666,//cdna.pcpartpicker.com/static/forever/images/product/ea959b55c8fb98a25c18332650b99097.256p.jpg,Full,,SFX,Black / Gold,ATX 3.x
Thermaltake Toughpower GT,750,90.46,80+ Gold,thermaltake toughpower gt version a fnfag 1,B-*,Circular fan grille; no info aside from internal shots from Thermaltake. Likely even more costdown A07B.,130.15,//cdna.pcpartpicker.com/static/forever/images/product/6914f8a3ed878aae940965c45a0799d4.256p.jpg,Full,,ATX,Beige,ATX 3.x
FSP Group HEXA 85+ PRO,550,90.74,80+ Bronze,fsp fortron sparkle hexa 85 pro,C*,85+ refresh? No internal shots or performance data available as of now.,100.38333333333333,https://m.media-amazon.com/images/I/41t+kAhuvcS.jpg,No,,ATX,Black,ATX 2.x
Thermaltake Smart BM3,650,91.99,80+ Bronze,thermaltake smart bm3,C,"Transient response was tested but values were left out. OPP is set very high, but the PSU handled it and shut down safely and properly.",128.55,//cdna.pcpartpicker.com/static/forever/images/product/4f3b7e2fa6212bc5d7addadf36fa2b1b.256p.jpg,Semi,,ATX,Black,ATX 3.x
Thermaltake Smart,500,92.22,80+,thermaltake smart white label,F,"Black casing, white sticker. Unknown number of suppliers for this unit. Versions that have been tested have malfunctioning OCP, OPP, and SCP.",136.45,https://m.media-amazon.com/images/I/519RlzaoKDL.jpg,No,,ATX,,ATX 2.x
